19144944,https://www.airbnb.com/rooms/19144944,20201025134909,2020-10-25,Country Garden Retreat,"This spacious retreat offers everything you need to relax and enjoy your stay in a country garden setting within easy walking distance of Corban University. Stargazers and eclipse-watchers will appreciate the open sky views.<br /><br /><b>The space</b><br />Our South Salem home is situated just outside the Salem city limits. The ground floor of this large house is all yours with over 1200 square feet of interior space.  Come and go as you please through a separate private entrance.<br /><br />Our property features pretty flower gardens, a large berry patch (in the summer, when berries are available, you can pick fresh blackberries or raspberries )!  There's lots of room to kick back and relax.<br /><br /><b>Guest access</b><br />Sleep tight in a quiet and cool bedroom with an extremely comfortable queen bed and luxury linens. A very comfortable twin air bed with a twin bed mattress topper is also available on request.  Enjoy a private bathroom and shower, wifi access, extra-large livin","We're in the country just enough to feel quiet and spacious, yet still conveniently located for easy freeway access and multiple shopping and dining options.<br /><br />- walk to Corban University<br />- Willamette University is 5.7 miles away<br />- downtown Salem is 7 miles away<br />- hiking and biking opportunities abound in easy driving distance, including the Riverfront City Park, Silver Falls State Park and the Oregon Garden.<br />- an hour's drive from Portland<br />- 65 miles to the Oregon Coast (Lincoln City is the nearest beach)<br />- Portland International Airport (PDX) 63.5 miles away<br />- Eugene Airport is 68 miles away",https://a0.muscache.com/pictures/1af6d700-a6fc-44f3-af72-c06d83688e42.jpg,133856626,https://www.airbnb.com/users/show/133856626,Diane,2017-06-07,"Salem, Oregon, United States","Tom and I are originally from the Portland area and have lived in Salem for over 40 years. We raised our three sons here and now enjoy the quiet, natural setting full of hummingbirds, woodpeckers and deer. This place is like our own private park. 

We've got loads of flowers here. Over the years, Tom has planted apple and cherry trees, a plum tree, a fig tree, rhubarb, herbs and tomatoes, and a big berry patch full of blackberries, raspberries, blueberries, strawberries and currants. We like to call it ""Tom's Berry Farm"" but it isn't really a farm - though we sometimes joke that we could probably open up a roadside stand with all the produce.

Family is the most important thing to us and we enjoy spending time with our kids and grand kids. Other interests include cooking, reading, salmon fishing and volunteering for local charities like the Marion County Food Bank and Assistance League.

Our youngest son introduced us to Airbnb and we're excited for the opportunity to meet new people and share our peaceful home. ",within an hour,100%,95%,t,https://a0.muscache.com/im/pictures/user/62bf3116-842f-4d44-9122-c47dd8c7b1f3.jpg?aki_policy=profile_small,https://a0.muscache.com/im/pictures/user/62bf3116-842f-4d44-9122-c47dd8c7b1f3.jpg?aki_policy=profile_x_medium,,1,1,"['email', 'phone', 'reviews', 'offline_government_id', 'government_id']",t,t,"Salem, Oregon, United States",Ward 3,,44.88863,-122.95169,Entire guest suite,Entire home/apt,2,,1 bath,1,1,"[""Extra pillows and blankets"", ""Lockbox"", ""Air conditioning"", ""Laptop-friendly workspace"", ""Free parking on premises"", ""Shampoo"", ""Coffee maker"", ""Carbon monoxide alarm"", ""Heating"", ""Wifi"", ""Bed linens"", ""Hangers"", ""Iron"", ""Smoke alarm"", ""Hot water"", ""Refrigerator"", ""Patio or balcony"", ""Microwave"", ""Garden or backyard"", ""Dishes and silverware"", ""Private entrance"", ""Essentials"", ""Hair dryer"", ""Shower gel"", ""Breakfast"", ""TV"", ""Fire extinguisher""]",$77.00,2,28,2,2,28,28,2.0,28.0,,t,0,0,0,89,2020-10-25,174,18,0,2017-07-28,2020-07-13,100,10,10,10,10,10,10,,f,1,1,0,0,4.40
19388806,https://www.airbnb.com/rooms/19388806,20201025134909,2020-10-25,"Cindy's Nook,  Suite, w/Private Entrance & Sauna","I love this opportunity to open up my home to share with Airbnb guests.  I offer a large private suite, with your own entry key.  Immaculate, sparkling clean living space, including a private bath with shower, bedroom nook with new queen size bed, large sitting area with sofa, TV and gas fireplace.  Additional room with a Swedish sauna (fluffy towels included), washer, dryer,  microwave, coffee maker and small refrigerator. Please be sure to ask if there is anything else you may need.<br /><br /><b>The space</b><br />Convenient South Salem home located in a quiet neighborhood.  Great location for walking to shops, grocery stores and parks. Close to downtown Salem, Bush Park and Willamette University. Wine country and the Oregon Coast is not far away! Information will be available for destinations of interest.<br /><br /><b>Guest access</b><br />Private key entrance that includes a  private spacious living area with many amenities.  You are welcome to enjoy a large outside deck which is","This is a quiet neighborhood in South Salem close to a variety of services that include dining, grocery stores and parks.  Our neighborhood is convenient to Willamette University, Bush Park, Salem Hospital, Downtown Salem and many places of interest.",https://a0.muscache.com/pictures/49e33cf4-6622-4b90-bff8-5cd664af93bd.jpg,42050514,https://www.airbnb.com/users/show/42050514,Cindy,2015-08-20,US,"I love opening up my home to guests.  I have been in banking, a personal chef & recently retired from the eyecare industry. I value client satisfaction & comfort.  My passions are outdoor activities, walking, biking, gardening plus food, cooking, and eating!  I've have always been an over the top cleaner.  Especially in todays climate, my attention to cleanliness is crucial .  My goal is to provide you with a relaxing, comfortable, safe stay.  I look forward to hosting you!",within an hour,100%,100%,t,https://a0.muscache.com/im/pictures/user/12d4e1a6-7453-49cb-8251-68633217ea2d.jpg?aki_policy=profile_small,https://a0.muscache.com/im/pictures/user/12d4e1a6-7453-49cb-8251-68633217ea2d.jpg?aki_policy=profile_x_medium,,1,1,"['email', 'phone', 'reviews']",t,f,"Salem, Oregon, United States",Ward 7,,44.91655,-123.04683,Private room in house,Private room,2,,1 private bath,1,1,"[""Long term stays allowed"", ""Free street parking"", ""Lock on bedroom door"", ""Lockbox"", ""Indoor fireplace"", ""Luggage dropoff allowed"", ""Laptop-friendly workspace"", ""Free parking on premises"", ""Shampoo"", ""Coffee maker"", ""Private living room"", ""Carbon monoxide alarm"", ""Heating"", ""BBQ grill"", ""Wifi"", ""Bed linens"", ""Hangers"", ""Iron"", ""Smoke alarm"", ""Dryer"", ""Hot water"", ""Refrigerator"", ""Patio or balcony"", ""Microwave"", ""Garden or backyard"", ""Cable TV"", ""Dishes and silverware"", ""First aid kit"", ""Private entrance"", ""Essentials"", ""Hair dryer"", ""Breakfast"", ""TV"", ""Washer"", ""Fire extinguisher""]",$75.00,1,1125,1,1,1125,1125,1.0,1125.0,,t,23,49,79,354,2020-10-25,230,56,2,2017-07-07,2020-10-20,99,10,10,10,10,10,10,,t,1,0,1,0,5.72
19394840,https://www.airbnb.com/rooms/19394840,20201025134909,2020-10-25,"Large Private, Waterfront Oasis","We welcome you to stay in our large, cozy in-law suite. Its expansive main window overlooks a beautiful koi pond, as well as a clear view of Salem's Mill Creek. Enjoy these sights while relaxing in our hammock or chair swing. Salem's downtown, Willamette University and the fairgrounds are all in walking/biking distance. At night, take in a magical view of the many garden lights throughout. You will have use of a full private bathroom, a washer/dryer, and, in the bedroom, a TV, kitchen and wifi.<br /><br /><b>The space</b><br />Our serene pond and waterfront setting is the perfect place to escape the city, yet it is within walking and biking distance to Salem's downtown attractions, university and the state fairgrounds. You can have the best of both worlds with our idyllic space. There is a coded private entrance that is well-lit at night for guests arriving after dark and parking for two vehicles. The TV is set up with Netflix, HBO, Hulu, Amazon and several other entertainment offering","We are the platform 9 3/4 of State street. We are in the city, yet the house feels as though it is in the middle of the woods. It allows for the perfect combination of urban and woodland experiences.",https://a0.muscache.com/pictures/43fa7a4f-e810-4bc4-ba9c-5812e1e38a99.jpg,61926106,https://www.airbnb.com/users/show/61926106,Nate & Renee,2016-03-07,"Salem, Oregon, United States","An Artist (painting/drawing) and a Language Arts Public School teacher. Introverted types who enjoy photography, hiking, kayaking, bike riding, making art, binge watching well written shows, live music, npr, and a chill night at an eye-catching bar. Relocated to Pacific NW in early 2015 from Baltimore. Loving this side of the country! ",within an hour,100%,96%,t,https://a0.muscache.com/im/pictures/user/37f022dc-904b-4b6d-b0aa-3757677fc35f.jpg?aki_policy=profile_small,https://a0.muscache.com/im/pictures/user/37f022dc-904b-4b6d-b0aa-3757677fc35f.jpg?aki_policy=profile_x_medium,,1,1,"['email', 'phone', 'reviews', 'jumio', 'selfie', 'government_id', 'identity_manual']",t,t,"Salem, Oregon, United States",Ward 2,,44.9316,-123.01174,Entire guest suite,Entire home/apt,5,,1 bath,1,2,"[""Extra pillows and blankets"", ""Single level home"", ""Free street parking"", ""Luggage dropoff allowed"", ""Laptop-friendly workspace"", ""Free parking on premises"", ""Shampoo"", ""Coffee maker"", ""Bathtub"", ""Carbon monoxide alarm"", ""Heating"", ""Room-darkening shades"", ""Waterfront"", ""Wifi"", ""Bed linens"", ""Hangers"", ""Iron"", ""Smoke alarm"", ""Dryer"", ""Hot water"", ""Kitchen"", ""Keypad"", ""Cleaning before checkout"", ""Refrigerator"", ""Patio or balcony"", ""Microwave"", ""Garden or backyard"", ""Cable TV"", ""Dishes and silverware"", ""First aid kit"", ""Private entrance"", ""Essentials"", ""Hair dryer"", ""TV"", ""Washer""]",$72.00,1,30,1,2,1125,1125,1.1,1125.0,,t,26,56,83,83,2020-10-25,234,76,2,2017-07-02,2020-10-04,96,10,10,10,10,10,10,,f,1,1,0,0,5.79
19411912,https://www.airbnb.com/rooms/19411912,20201025134909,2020-10-25,A,"Price dropped from $333.00 a night.<br /><br />Beautiful bedroom with 1 very comfy Queen bed in a Nice family Home ~ <br />Stays include a home-cooked breakfast!<br /><br />Craftsman home next to town, so quiet, at the end of a dead-end street.<br />Walk to town or ride our bikes. <br />Price is per room. Each room sleeps 2, possibly 3.<br />Children are welcome!<br />We have a sweet Great Pyrenees (dog), two cats (mostly outside) and 2 docile chickens in our family.<br /><br /><b>Guest access</b><br />Whole house<br /><br /><b>Other things to note</b><br />I am putting together a viewing deck with table and comfy chairs. <br />Also, if it turns out the weather forecast is not good I will provide instructions for driving East, toward the mountains, where there are clearer skys.","Very quiet, country like, even though we are right in town. Walking distance to parks, stores, downtown, the riverfront.",https://a0.muscache.com/pictures/23868a56-0996-4000-a7d5-43e140b9cf77.jpg,10675141,https://www.airbnb.com/users/show/10675141,Patrick,2013-12-17,"Kona, Hawaii & Salem, Oregon, USA","",N/A,N/A,N/A,f,https://a0.muscache.com/im/pictures/user/0282dbe0-7669-461f-849c-f812a88f404f.jpg?aki_policy=profile_small,https://a0.muscache.com/im/pictures/user/0282dbe0-7669-461f-849c-f812a88f404f.jpg?aki_policy=profile_x_medium,,4,4,"['email', 'phone', 'facebook', 'reviews', 'jumio', 'government_id']",t,t,"Salem, Oregon, United States",Ward 1,,44.94763,-123.06203,Shared room in apartment,Shared room,1,,2 shared baths,1,1,"[""Indoor fireplace"", ""Air conditioning"", ""Laptop-friendly workspace"", ""Free parking on premises"", ""Stove"", ""Shampoo"", ""Coffee maker"", ""Carbon monoxide alarm"", ""Dishwasher"", ""Heating"", ""Bed linens"", ""Hangers"", ""Iron"", ""Smoke alarm"", ""Dryer"", ""Hot water"", ""Kitchen"", ""Refrigerator"", ""Patio or balcony"", ""Garden or backyard"", ""Dishes and silverware"", ""First aid kit"", ""Stair gates"", ""Cooking basics"", ""Essentials"", ""Hair dryer"", ""Breakfast"", ""TV"", ""Oven"", ""Washer"", ""Fire extinguisher""]",$199.00,1,2,1,1,2,2,1.0,2.0,,t,30,60,90,365,2020-10-25,0,0,0,,,,,,,,,,,t,2,0,1,1,
19468058,https://www.airbnb.com/rooms/19468058,20201025134909,2020-10-25,Home is charming & cozy & clean & crazy cool!,"Located on a quiet street, my home is open to anyone looking for a comfortable, clean, and conveniently located place to stay while visiting Salem and surrounding area (45 minute drive to Portland).  My home is sparkling clean.<br /><br /><b>The space</b><br />I live in my home when not occupied by guests.  Thus, you have access to pretty much everything a typical household might have.  The backyard is beautiful (I need to update my photos as there is now a patio table and 6 chairs and picnic table is by the hammock) and in summer there are 5 blueberry bushes packed full of berries and ready to pick and eat by late June.<br /><br /><b>Guest access</b><br />The entire house is yours (including a spacious backyard).  You may park your vehicle in the garage or on the street.  The kitchen is stocked with typical household condiments, as well as coffee and tea.  Three year old washer and dryer for your use including detergent.<br /><br /><b>Other things to note</b><br />Covid-19 update:  Pe","My home is located on a quiet street close to food, fuel and shopping. Salem is expanding with new restaurants and coffee shops: Rafn's and Archive are two of my favorites. But don't forget Kim Huong (Vietnamese), Wild Pear (Northwest cuisine), Ritter's (pizza + vegetarian) and Word of Mouth (the breakfast spot).  <br /><br />Bush Park and the Waterfront Park offer trails, playgrounds, and grass space - great for individuals and families. <br /><br />Looking to explore outside of Salem? Head an hour south to Corvallis, home of the Oregon State Beavers, Eugene, home of the Oregon Ducks, or an hour North to Portland, foodie paradise and more.",https://a0.muscache.com/pictures/a026df3c-9c2d-42b3-b845-7e0defd6ac29.jpg,29091120,https://www.airbnb.com/users/show/29091120,Victoria,2015-03-10,"Salem, Oregon, United States","Hi!

Five years ago, the travel bug hit me, and I spent six months in Thailand, before venturing throughout the United States and then spending another three months in Thailand, Cambodia and Malaysia. I grew up on Air Force bases in Alaska, California, Florida, Washington, Oregon and the Philippine Islands.

I want to open up my home so that others can experience an authentic travel experience while visiting Oregon, a truly beautiful state, if I do say so myself!  Salem is the capitol of Oregon and approximately 45 miles south of our beloved Portland and an hour from our stunning coast.

I am happy to answer any of your questions or share any tips about the area; please do not hesitate to reach out to me. 

And thank you for looking at my listing.

Victoria",within a few hours,100%,73%,f,https://a0.muscache.com/im/users/29091120/profile_pic/1425992929/original.jpg?aki_policy=profile_small,https://a0.muscache.com/im/users/29091120/profile_pic/1425992929/original.jpg?aki_policy=profile_x_medium,,1,1,"['email', 'phone', 'facebook', 'google', 'reviews', 'kba']",t,t,"Salem, Oregon, United States",Ward 4,,44.87809,-123.03331,Entire house,Entire home/apt,2,,1 bath,2,2,"[""Single level home"", ""Long term stays allowed"", ""Free street parking"", ""Air conditioning"", ""Laptop-friendly workspace"", ""Sony sound system with Bluetooth and aux"", ""Free parking on premises"", ""Freezer"", ""Stove"", ""Baking sheet"", ""Shampoo"", ""Coffee maker"", ""Bathtub"", ""Carbon monoxide alarm"", ""Dishwasher"", ""Heating"", ""Pour Over Coffee"", ""Wifi"", ""Bed linens"", ""Hangers"", ""Iron"", ""Smoke alarm"", ""Dryer"", ""Hot water"", ""Kitchen"", ""Keypad"", ""Refrigerator"", ""Ceiling fan"", ""Microwave"", ""Dove body soap"", ""Patio or balcony"", ""Garden or backyard"", ""Dishes and silverware"", ""First aid kit"", ""Cooking basics"", ""Private entrance"", ""Essentials"", ""Hair dryer"", ""TV"", ""Oven"", ""Washer"", ""Fire extinguisher""]",$88.00,2,1125,2,2,1125,1125,2.0,1125.0,,t,10,10,10,126,2020-10-25,27,2,1,2017-08-21,2020-10-16,99,10,10,10,10,10,10,,f,1,1,0,0,0.70
19475795,https://www.airbnb.com/rooms/19475795,20201025134909,2020-10-25,"Big home with pool, outdoor area","Very casual craftsman style house with large windows and an inviting backyard space.  10 minute walk to Starbucks and two miles from great restaurants, bars and shopping. 1 hour from Portland International Airport.  A Great Pool and outdoors living space Great for The Eclipse",,https://a0.muscache.com/pictures/9c9e50e9-f82e-4a7a-897b-3683dbd8be81.jpg,136654813,https://www.airbnb.com/users/show/136654813,Jake,2017-06-23,"Salem, Oregon, United States",A low key family of 4 who enjoy going on adventures and having fun as a family!,N/A,N/A,N/A,f,https://a0.muscache.com/im/pictures/user/616d05f5-7447-416d-be8e-655a9e12ee9e.jpg?aki_policy=profile_small,https://a0.muscache.com/im/pictures/user/616d05f5-7447-416d-be8e-655a9e12ee9e.jpg?aki_policy=profile_x_medium,,1,1,"['email', 'phone', 'offline_government_id', 'government_id']",t,t,,Ward 8,,44.95896,-123.06491,Entire house,Entire home/apt,8,,2.5 baths,4,4,"[""Extra pillows and blankets"", ""Pool"", ""Indoor fireplace"", ""Air conditioning"", ""Laptop-friendly workspace"", ""Free parking on premises"", ""Oven"", ""Stove"", ""Shampoo"", ""Coffee maker"", ""Carbon monoxide alarm"", ""Dishwasher"", ""Heating"", ""BBQ grill"", ""Beach essentials"", ""Wifi"", ""Bed linens"", ""Hangers"", ""Iron"", ""Smoke alarm"", ""Dryer"", ""Hot water"", ""Kitchen"", ""Keypad"", ""Refrigerator"", ""Patio or balcony"", ""Microwave"", ""Garden or backyard"", ""Cable TV"", ""Dishes and silverware"", ""First aid kit"", ""Cooking basics"", ""Private entrance"", ""Essentials"", ""Hair dryer"", ""Breakfast"", ""TV"", ""Ethernet connection"", ""Washer""]","$1,400.00",3,3,3,3,3,3,3.0,3.0,,t,28,58,88,88,2020-10-25,0,0,0,,,,,,,,,,,t,1,1,0,0,
19532562,https://www.airbnb.com/rooms/19532562,20201025134909,2020-10-25,Historic Cottage close to downtown for Eclipse,"This cozy 1910 Cottage is in a historic district walking distance from downtown, restaurants and the Capitol Building in Salem. Prefect place to stay and relax while in town to watch the 2017 Eclipse. There is a front porch, side porch and back yard with off-street parking.",,https://a0.muscache.com/pictures/4900fa8c-e3f0-46df-bf30-48f519357439.jpg,134427390,https://www.airbnb.com/users/show/134427390,Nathan,2017-06-10,"Ontario, Oregon, United States","",a few days or more,0%,N/A,f,https://a0.muscache.com/im/pictures/user/c63d3b36-3c4d-4389-a46c-67976fae5d71.jpg?aki_policy=profile_small,https://a0.muscache.com/im/pictures/user/c63d3b36-3c4d-4389-a46c-67976fae5d71.jpg?aki_policy=profile_x_medium,,2,2,"['email', 'phone', 'reviews']",t,f,,Ward 1,,44.93868,-123.02154,Entire house,Entire home/apt,4,,1 bath,1,1,"[""Shampoo"", ""Hangers"", ""Iron"", ""Smoke alarm"", ""Carbon monoxide alarm"", ""Essentials"", ""Hair dryer"", ""Free parking on premises"", ""TV""]","$1,000.00",2,6,2,2,6,6,2.0,6.0,,t,30,60,90,365,2020-10-25,1,0,0,2017-08-21,2017-08-21,100,10,10,10,10,10,10,,f,1,1,0,0,0.03
19703543,https://www.airbnb.com/rooms/19703543,20201025134909,2020-10-25,In Eclipse Zone: Private Master Bedroom w/ Bath,"In the Eclipse Totality Zone. This spacious room is in a manufactured home located in A park for private homes. Has a bunk bed for two people and a full bathroom, with enough space in the room for an air mattress for one more person to sleep in it. It is not far from the southbound I-5 entrance on commercial and a mile from the Keubler exit/entrance. The house is within 20 minutes walking distance of food and groceries.  The local bus line is a ten minute walk going by the area on weekdays only.",,https://a0.muscache.com/pictures/a588266b-7b79-4197-823b-effa0f971ae3.jpg,138834613,https://www.airbnb.com/users/show/138834613,William,2017-07-06,"Salem, Oregon, United States","",N/A,N/A,N/A,f,https://a0.muscache.com/im/pictures/user/464bae2a-0515-48e0-bee6-2288a0148285.jpg?aki_policy=profile_small,https://a0.muscache.com/im/pictures/user/464bae2a-0515-48e0-bee6-2288a0148285.jpg?aki_policy=profile_x_medium,,1,1,"['phone', 'jumio', 'offline_government_id', 'selfie', 'government_id', 'identity_manual']",t,t,,Ward 4,,44.8661,-123.01542,Private room in house,Private room,2,,1 private bath,1,2,"[""Shampoo"", ""Iron"", ""Smoke alarm"", ""First aid kit"", ""Lock on bedroom door"", ""Essentials"", ""Dryer"", ""Laptop-friendly workspace"", ""Heating"", ""TV"", ""Washer""]",$505.00,2,7,2,2,7,7,2.0,7.0,,t,28,58,88,178,2020-10-25,0,0,0,,,,,,,,,,,t,1,0,1,0,
19789195,https://www.airbnb.com/rooms/19789195,20201025134909,2020-10-25,Eastlake Place,"Beautiful 2093 sq ft house in South Salem. It's 4 bedroom, 2.5 bath with central air, huge back yard with a play structure. Upstairs there are 4 bedrooms: 2 bedrooms have queen size beds, 1 has twin bed w/a twin trundle underneath, then the last bedroom has a crib; there's also another full bath and laundry room. Downstairs theirs a kitchen with breakfast bar, dining room, living room and family room (both rooms have directv).",,https://a0.muscache.com/pictures/5a7b53de-8989-4c83-acfc-8d2a2df2e11b.jpg,139732464,https://www.airbnb.com/users/show/139732464,Carla,2017-07-10,US,"",N/A,N/A,N/A,f,https://a0.muscache.com/im/pictures/user/30ee4aa1-974b-4907-a5ff-d068e2668124.jpg?aki_policy=profile_small,https://a0.muscache.com/im/pictures/user/30ee4aa1-974b-4907-a5ff-d068e2668124.jpg?aki_policy=profile_x_medium,,1,1,['phone'],t,f,,Ward 4,,44.87995,-123.00751,Entire house,Entire home/apt,6,,2.5 baths,4,4,"[""Host greets you"", ""Shampoo"", ""Hangers"", ""Smoke alarm"", ""Carbon monoxide alarm"", ""First aid kit"", ""Dryer"", ""Air conditioning"", ""Essentials"", ""Kitchen"", ""Heating"", ""Free parking on premises"", ""TV"", ""Washer""]","$1,000.00",1,4,1,2,4,4,1.0,4.0,,t,29,59,89,89,2020-10-25,0,0,0,,,,,,,,,,,f,1,1,0,0,
