id,listing_url,scrape_id,last_scraped,name,description,neighborhood_overview,picture_url,host_id,host_url,host_name,host_since,host_location,host_about,host_response_time,host_response_rate,host_acceptance_rate,host_is_superhost,host_thumbnail_url,host_picture_url,host_neighbourhood,host_listings_count,host_total_listings_count,host_verifications,host_has_profile_pic,host_identity_verified,neighbourhood,neighbourhood_cleansed,neighbourhood_group_cleansed,latitude,longitude,property_type,room_type,accommodates,bathrooms,bathrooms_text,bedrooms,beds,amenities,price,minimum_nights,maximum_nights,minimum_minimum_nights,maximum_minimum_nights,minimum_maximum_nights,maximum_maximum_nights,minimum_nights_avg_ntm,maximum_nights_avg_ntm,calendar_updated,has_availability,availability_30,availability_60,availability_90,availability_365,calendar_last_scraped,number_of_reviews,number_of_reviews_ltm,number_of_reviews_l30d,first_review,last_review,review_scores_rating,review_scores_accuracy,review_scores_cleanliness,review_scores_checkin,review_scores_communication,review_scores_location,review_scores_value,license,instant_bookable,calculated_host_listings_count,calculated_host_listings_count_entire_homes,calculated_host_listings_count_private_rooms,calculated_host_listings_count_shared_rooms,reviews_per_month
1159564,https://www.airbnb.com/rooms/1159564,20201025134909,2020-10-25,SOLAR ECLIPSE - A,"I have 2 rooms to rent for the solar eclipse on August 21, 2017.  (one room has been rented, the other is still available)<br /><br />NOTE:  I AM RENTING EACH ROOM SEPARATELY - THIS PRICE IS PER ROOM.  $175 PER NIGHT PER ROOM - 2 NIGHT MINIMUM PER ROOM.<br /><br />Private room  -  queen bed - nicely decorated and comfortable.  Bathroom is at the end of the hall.<br /><br />MUST love animals as I currently have 1 big dog and a 2 cats<br /><br /><b>The space</b><br />Both rooms are very nice with a queen beds - house has central A/C  and the house is clean and spacious.  Both guest rooms will sleep 2 comfortably<br /><br />NOTE:  I AM RENTING EACH ROOM SEPARATELY - THIS PRICE IS PER ROOM.  $175 PER NIGHT PER ROOM - 2 NIGHT MINIMUM PER ROOM.<br /><br />This is for the lunar eclipse in August 2017<br /><br /><b>Guest access</b><br />Guests will have access to the kitchen, family room, living room and dining room.  As well as a beautiful deck and hot tub.  There is a new HDTV in the guests ",House is on a quiet cul de sac in a lovely neighborhood on top of a hill.  Views off the deck are facing north and you can see the hills and trees - sometimes I think I can see Portland :-).  It is very quiet and peaceful.,https://a0.muscache.com/pictures/17443814/ab424f3e_original.jpg,2185672,https://www.airbnb.com/users/show/2185672,Roberta,2012-04-20,"Salem, Oregon, United States","Hi - I have been retired for two years and am enjoying life.  I live with my fur kids - Duncan, a lovable flat coated retriever and  1 cat.  I have a lovely home where you can enjoy the deck, the yard and the hot tub.  I live on top of a hill with lovely views.  

I will be at home when you are here and you are welcome to join me in the family to watch TV, read a book or chat.  You are also welcome to use the kitchen, please ask for assistance.  I have a Keurig for those of you that drink coffee - I enjoy my morning cup.

Looking forward to making some new friends.

Thank you,
Roberta",N/A,N/A,N/A,f,https://a0.muscache.com/im/pictures/user/2334c6d2-53c2-4eaa-90e2-206003e2b748.jpg?aki_policy=profile_small,https://a0.muscache.com/im/pictures/user/2334c6d2-53c2-4eaa-90e2-206003e2b748.jpg?aki_policy=profile_x_medium,,2,2,"['email', 'phone', 'facebook', 'reviews', 'kba']",t,t,"Salem, Oregon, United States",Ward 3,,44.88416,-123.04341,Private room in house,Private room,4,,1 shared bath,2,2,"[""Cable TV"", ""Smoke alarm"", ""Carbon monoxide alarm"", ""Dryer"", ""Air conditioning"", ""Hot tub"", ""Kitchen"", ""Heating"", ""Free parking on premises"", ""TV"", ""Wifi"", ""Washer""]",$175.00,2,1125,2,2,1125,1125,2.0,1125.0,,t,30,60,90,365,2020-10-25,2,0,0,2013-08-14,2013-08-30,90,10,10,10,10,10,9,,f,1,0,1,0,0.02
2894591,https://www.airbnb.com/rooms/2894591,20201025134909,2020-10-25,Quiet and cozy home in South Salem.,"This cozy, tidy, and well kept home is located in the south Salem hills away from the hustle and bustle.  The home is easily accessible to the downtown area, close to shops, parks, restaurants.  Enjoy the quiet, trees, birds, on two private decks.<br /><br /><b>The space</b><br />My home is nestled in a wooded area within the city limits, however, the setting is rural and quiet.  Guests have a private bedroom and bathroom.  The large windows throughout the home provide natural light with excellent views of nature and outdoor critters.<br /><br /><b>Guest access</b><br />Guests have access to the main living area, kitchen, laundry, private bedroom and bathroom, large closet, two decks, and Wifi.","I live in a great neighborhood and have been here for about 30 years.  I love the outdoor area as well as my close proximity to the main downtown area.  Downtown Salem has many locally owned restaurants and night spots.  I am also very close to Willamette University.  Guests will experience a unique, clean, quiet, and welcoming area in Salem.",https://a0.muscache.com/pictures/37383808/1df5f09d_original.jpg,14613038,https://www.airbnb.com/users/show/14613038,Sue,2014-04-22,"Salem, Oregon, United States","I have lived in my home in South Salem for 30 years.  It is a great place, very comfortable -- and easy to maintain.
I grew up in Eugene, Oregon but graduated from Oregon State in Corvallis. I was a high school teacher for 12 years.  Part of my teaching years were in Australia.  Very fond memories of living and traveling in Australia.  (My son was born in Australia.)
I work full time for Polk County in Dallas, Oregon.  I am a case manager for individuals with intellectual/development disabilities and I also license all of the adult foster homes in Polk County.
I enjoy skiing, working in my yard, going to movies, going to concerts, and spending time with my family.  I am also an avid NASCAR fan and football fan (college and professional.)
Hosting individuals in my home has been a rewarding experience.  I enjoy entertaining, meeting new and interesting people.  I want individuals staying at my home to have a restful, enjoyable, and comfortable experience.
Life motto;  Work hard, have fun, and be nice.",within a few hours,75%,60%,f,https://a0.muscache.com/im/users/14613038/profile_pic/1409412006/original.jpg?aki_policy=profile_small,https://a0.muscache.com/im/users/14613038/profile_pic/1409412006/original.jpg?aki_policy=profile_x_medium,,1,1,"['email', 'phone', 'reviews', 'offline_government_id', 'selfie', 'government_id', 'identity_manual']",t,t,"Salem, Oregon, United States",Ward 7,,44.90754,-123.07688,Private room in house,Private room,2,,1 private bath,1,1,"[""Extra pillows and blankets"", ""Single level home"", ""Long term stays allowed"", ""Luggage dropoff allowed"", ""Indoor fireplace"", ""Laptop-friendly workspace"", ""Free parking on premises"", ""Stove"", ""Shampoo"", ""Coffee maker"", ""Carbon monoxide alarm"", ""Dishwasher"", ""Heating"", ""Wifi"", ""Bed linens"", ""Hangers"", ""Iron"", ""Smoke alarm"", ""Dryer"", ""Hot water"", ""Kitchen"", ""Refrigerator"", ""Patio or balcony"", ""Microwave"", ""Host greets you"", ""Garden or backyard"", ""Cable TV"", ""Dishes and silverware"", ""First aid kit"", ""Cooking basics"", ""Essentials"", ""Hair dryer"", ""Breakfast"", ""TV"", ""Oven"", ""Washer"", ""Fire extinguisher""]",$50.00,1,1125,1,1,1125,1125,1.0,1125.0,,t,0,0,0,177,2020-10-25,192,3,0,2014-06-15,2020-07-22,98,10,10,10,10,10,10,,f,2,0,2,0,2.48
3454856,https://www.airbnb.com/rooms/3454856,20201025134909,2020-10-25,Quiet and cozy home in South Salem,"My home is located in a well established and well kept neighborhood in the Croisan Hills. The area is quiet yet close to the downtown and within walking distance of a family friendly park.  Guests will enjoy the comfy queen bed and private bathroom.<br /><br /><b>The space</b><br />My home in South Salem is homey, comfortable, clean, neat, and tidy.  Even though my home has two bedroom/two bathrooms, the main living area is open with lots of natural light.  The kitchen is large and also open. My home is nicely decorated with interesting art inside and out.<br /><br /><b>Guest access</b><br />Guests have access to the entire home - inside and out.","My neighborhood have nice and well kept homes.  My home is located in the Croisan Hills.  Lots of trees, sidewalks, family park within walking distance, and Minto Brown Park is very close.  The homes on my street are unique and we have fairly large lots.",https://a0.muscache.com/pictures/43684611/3928879b_original.jpg,14613038,https://www.airbnb.com/users/show/14613038,Sue,2014-04-22,"Salem, Oregon, United States","I have lived in my home in South Salem for 30 years.  It is a great place, very comfortable -- and easy to maintain.
I grew up in Eugene, Oregon but graduated from Oregon State in Corvallis. I was a high school teacher for 12 years.  Part of my teaching years were in Australia.  Very fond memories of living and traveling in Australia.  (My son was born in Australia.)
I work full time for Polk County in Dallas, Oregon.  I am a case manager for individuals with intellectual/development disabilities and I also license all of the adult foster homes in Polk County.
I enjoy skiing, working in my yard, going to movies, going to concerts, and spending time with my family.  I am also an avid NASCAR fan and football fan (college and professional.)
Hosting individuals in my home has been a rewarding experience.  I enjoy entertaining, meeting new and interesting people.  I want individuals staying at my home to have a restful, enjoyable, and comfortable experience.
Life motto;  Work hard, have fun, and be nice.",within a few hours,75%,60%,f,https://a0.muscache.com/im/users/14613038/profile_pic/1409412006/original.jpg?aki_policy=profile_small,https://a0.muscache.com/im/users/14613038/profile_pic/1409412006/original.jpg?aki_policy=profile_x_medium,,1,1,"['email', 'phone', 'reviews', 'offline_government_id', 'selfie', 'government_id', 'identity_manual']",t,t,"Salem, Oregon, United States",Ward 7,,44.90781,-123.07676,Private room in house,Private room,2,,2 baths,1,1,"[""Shampoo"", ""Cable TV"", ""Smoke alarm"", ""First aid kit"", ""Dryer"", ""Essentials"", ""Indoor fireplace"", ""Kitchen"", ""Heating"", ""Free parking on premises"", ""Breakfast"", ""TV"", ""Wifi"", ""Washer"", ""Fire extinguisher""]",$50.00,1,1125,1,1,1125,1125,1.0,1125.0,,t,15,41,44,319,2020-10-25,2,0,0,2014-07-27,2014-09-06,80,10,10,8,9,10,10,,f,2,0,2,0,0.03
4394073,https://www.airbnb.com/rooms/4394073,20201025134909,2020-10-25,Warm and Welcoming in Downtown.,"Beautiful large home build in 1906. Located just half mile from the capital building and one mile from Salem Hospital and River Front Park, with pedestrian bridges to connect to two other very large park systems. Home has all the essential needs, a secluded back yard, wifi internet, and all normal kitchen amenities. <br />Perfect for travel medical professionals!!<br /><br /><b>The space</b><br />This home is extremely comfortable. You will have a relaxing time just resting up in the living room, taking in the sun out on the deck, or exploring the beautiful downtown area.<br /><br /><b>Guest access</b><br />This space will provide all the comforts of your own home. You will have full access to the kitchen, laundry, and all other basic living necessities you would require. If I don't have it, please ask! And I'll do my best to accommodate to your needs.<br /><br /><b>Other things to note</b><br />Parking is best done on the street directly in front of the house. I have never experienced","Close to Salem Hospital, Downtown Salem, Amtrak Station,  Oregon State Capital",https://a0.muscache.com/pictures/859cea2b-f08a-40f0-8988-321b96512a73.jpg,22810342,https://www.airbnb.com/users/show/22810342,Michael,2014-10-21,"Salem, Oregon, United States",I'm a young professional looking to extend some unused space in my home to fellow travelers. I strive to maintain a peaceful environment and overall provide a comfortable and warm place to stay. I look forward to meeting you and hope you find my place inviting and enjoyable!!,within a few hours,100%,100%,f,https://a0.muscache.com/im/pictures/user/aec32533-ce76-4f06-af20-3bd172fe4bd7.jpg?aki_policy=profile_small,https://a0.muscache.com/im/pictures/user/aec32533-ce76-4f06-af20-3bd172fe4bd7.jpg?aki_policy=profile_x_medium,Grant,1,1,"['email', 'phone', 'reviews', 'offline_government_id', 'kba', 'selfie', 'government_id', 'identity_manual']",t,t,"Salem, Oregon, United States",Ward 1,,44.94813,-123.02229,Private room in house,Private room,2,,1 shared bath,1,1,"[""Long term stays allowed"", ""Free street parking"", ""Lock on bedroom door"", ""Lockbox"", ""Indoor fireplace"", ""Air conditioning"", ""Luggage dropoff allowed"", ""Laptop-friendly workspace"", ""Free parking on premises"", ""Stove"", ""Shampoo"", ""Coffee maker"", ""Bathtub"", ""Carbon monoxide alarm"", ""Dishwasher"", ""Heating"", ""BBQ grill"", ""Wifi"", ""Hangers"", ""Iron"", ""Smoke alarm"", ""Dryer"", ""Hot water"", ""Kitchen"", ""Refrigerator"", ""Patio or balcony"", ""Microwave"", ""Garden or backyard"", ""Cable TV"", ""Dishes and silverware"", ""First aid kit"", ""Cooking basics"", ""Essentials"", ""TV"", ""Oven"", ""Washer""]",$44.00,2,1125,1,2,1125,1125,1.6,1125.0,,t,16,38,38,245,2020-10-25,103,4,0,2014-11-14,2020-04-01,97,10,10,10,10,10,10,,t,2,1,1,0,1.42
4785215,https://www.airbnb.com/rooms/4785215,20201025134909,2020-10-25,Century House Doug Fir Room,"Century House is just a few blocks from downtown, Bush Park, the Capitol, Willamette University, and Amtrak. Double bed, brand new private bathroom, kitchenette, two sitting rooms, with fireplace.  Hi-speed internet.  Park-like back yard with fire pit. Bicycles (plus gear, maps) for rent.   Anytime coffee/tea/treats. Complimentary homemade morning pastry or fruit parfait.  Full-course breakfast available for $10.00/person.<br /><br /><b>The space</b><br />Location, location, location. <br />Century House is just that.  Built in 1912, it has been through flood and earthquake, but has been lovingly renovated to reflect the New England heritage of your hostess, Jean.  Filled with modern amenities, and many non-fiction adventure books, games, a century-old baby grand piano.  No TV, and no apologies :-).<br /><br /><b>Guest access</b><br />Coffee, tea, the cookie jar, the shady back yard, the common room, an extra sitting room, kitchenette, off-street parking, carriage house bicycle parking",Walking/bicycling access to everything!,https://a0.muscache.com/pictures/04e49d64-313b-4ddc-9df3-6e2a47b8a40d.jpg,10502090,https://www.airbnb.com/users/show/10502090,Jean,2013-12-08,"Salem, Oregon, United States","Bicycling is my passion and my past-time, as well as my recipe for physical and emotional well-being.  Most recently, I have enjoyed “packing down” my bike with gear and heading down the road - for an overnight, or three, or three weeks.  This gives a whole new meaning to “bed and breakfast”.

When I’m not cycling, I’m usually busy cooking, cleaning, reading, sewing or watching the trees and flowers grow in my little forest; and, of course, accommodating the many fascinating guests who find their way to Century House from all corners of the globe.  My life is truly enriched by the diversity of perspectives and experiences that guests bring with them.

I confess, my favorite guests may be the children. With a full career of working in the field of early childhood, I never cease to be wowed by the uninhibited enthusiasm, curiosity, and resilience of the younger generation.  I am thrilled and dedicated to being a family-friendly business.

Another of my endeavors is the promotion/education of good nutrition.  I might be seen pedaling to a local farm to fill my packs with broccoli for the local food bank  - or, with fresh kale for a morning smoothie :-).  Don’t worry, there is still room for a brownie or an oatmeal cookie on the dessert tray.  After all, we need our dark chocolate, and our oatmeal, right?  

",within an hour,100%,93%,t,https://a0.muscache.com/im/users/10502090/profile_pic/1418163815/original.jpg?aki_policy=profile_small,https://a0.muscache.com/im/users/10502090/profile_pic/1418163815/original.jpg?aki_policy=profile_x_medium,,3,3,"['email', 'phone', 'reviews', 'kba']",t,t,"Salem, Oregon, United States",Ward 2,,44.93448,-123.02103,Private room in bed and breakfast,Private room,2,,1 private bath,1,1,"[""Extra pillows and blankets"", ""Children\u2019s books and toys"", ""Free street parking"", ""Lock on bedroom door"", ""Luggage dropoff allowed"", ""Indoor fireplace"", ""Laptop-friendly workspace"", ""Free parking on premises"", ""Shampoo"", ""Coffee maker"", ""High chair"", ""Carbon monoxide alarm"", ""Heating"", ""Wifi"", ""Bed linens"", ""Hangers"", ""Pack \u2019n Play/travel crib"", ""Iron"", ""Smoke alarm"", ""Dryer"", ""Hot water"", ""Kitchen"", ""Refrigerator"", ""Outlet covers"", ""Microwave"", ""Host greets you"", ""Garden or backyard"", ""Dishes and silverware"", ""First aid kit"", ""Cooking basics"", ""Essentials"", ""Hair dryer"", ""Shower gel"", ""Washer""]",$89.00,2,1125,2,2,1125,1125,2.0,1125.0,,t,18,48,78,353,2020-10-25,84,7,1,2015-01-05,2020-10-11,99,10,10,10,10,10,10,,f,3,0,3,0,1.19
7293821,https://www.airbnb.com/rooms/7293821,20201025134909,2020-10-25,Chauffeurs Room @ the Villa,"Our home is in the quaint historic Fairmount Hills Neighborhood. This loft is great for business travelers, couples, and solo adventurers. We are close to Downtown, Bush Park, Salem Hospital, Willamette University,  and Convention Center. We are also a great home base  for exploring wineries and other communities. Our neighborhood is a safe place to walk and explore and our property has security cameras to enhance your safety.<br /><br /><b>The space</b><br />The studio is a quiet, private retreat above the garage, with all the necessities for a comfortable stay. The kitchen is equipped with fridge, microwave, hotplate, toaster and electric kettle. <br /><br />We will get you started with homemade granola and sometimes a baked treat.  Complimentary tea and coffee are provided along with a long list of restaurant recommendations. <br /><br />The queen size, pillow top mattress is made up with luxury linens. <br /><br />Guests are welcome to use the back patio and feel free to stroll thr","Safe, quiet community, historic neighborhood. The studio is a few blocks from the Salem Art Fair, a short walk to eateries, museums, library, parks, Salem Hospital, Willamette University and the Capitol. This is wine country and we will be happy to share our favorites for you to visit.",https://a0.muscache.com/pictures/75816eaa-7dbe-4e6a-8ce3-5834f31d5169.jpg,38202007,https://www.airbnb.com/users/show/38202007,Julie,2015-07-11,"Salem, Oregon, United States","We are an active couple that loves our home, neighborhood and surrounding area. We love the solitude of hiking and the warmth of an evening surrounded by family and friends. ",within an hour,100%,100%,t,https://a0.muscache.com/im/pictures/user/1e803e60-ae1c-4e3d-953f-d6bef834b220.jpg?aki_policy=profile_small,https://a0.muscache.com/im/pictures/user/1e803e60-ae1c-4e3d-953f-d6bef834b220.jpg?aki_policy=profile_x_medium,,1,1,"['email', 'phone', 'reviews', 'jumio', 'government_id']",t,t,"Salem, Oregon, United States",Ward 7,,44.92484,-123.0499,Entire guest suite,Entire home/apt,2,,1 bath,,1,"[""Extra pillows and blankets"", ""Free street parking"", ""Lockbox"", ""Luggage dropoff allowed"", ""Air conditioning"", ""Laptop-friendly workspace"", ""Free parking on premises"", ""Shampoo"", ""Coffee maker"", ""Carbon monoxide alarm"", ""Heating"", ""BBQ grill"", ""Wifi"", ""Bed linens"", ""Hangers"", ""Pack \u2019n Play/travel crib"", ""Iron"", ""Smoke alarm"", ""Hot water"", ""Kitchen"", ""Refrigerator"", ""Patio or balcony"", ""Microwave"", ""Garden or backyard"", ""Cable TV"", ""Dishes and silverware"", ""First aid kit"", ""Cooking basics"", ""Private entrance"", ""Essentials"", ""Hair dryer"", ""Breakfast"", ""TV"", ""Fire extinguisher""]",$98.00,1,28,1,3,1125,1125,1.3,1125.0,,t,18,48,78,78,2020-10-25,332,44,5,2015-07-19,2020-10-16,99,10,10,10,10,10,10,,t,1,1,0,0,5.17
8255984,https://www.airbnb.com/rooms/8255984,20201025134909,2020-10-25,Downtown Salem Loft in Salem Oregon,"As it has always been, the safety and security of our guests remains our highest priority. We take great pride in maintaining the highest standards of cleanliness and hygiene. I myself have personally provided direct patient care for over 39 years. In response to the coronavirus, we have taken additional measures developed in consultation with global and local public health authorities (including the WHO and CDC) to make our cleaning and hygiene protocols even more rigorous. Adults only please!<br /><br /><b>The space</b><br />Our teams are receiving ongoing briefings and enhanced operating protocols.<br />We have increased the frequency of cleaning our public areas (including lobbies, door handles, etc.) and have continued the use of hospital-grade disinfectant.<br />We have increased the deployment of antibacterial hand sanitizers.<br />We have even made personal take home antibacterial hand sanitizers for your purse or travel bag.Salem Oregon City Center New York style loft located ","This loft is located 4 city blocks from the Oregon State Capitol. 5 city blocks from Willamette University and Halle Ford Museum. 2 blocks from the Salem Convention Center. 1 block from Riverfront park and the Willamette River. Front door opens to downtown boutique shops and restaurants.  Full service mall, Salem Center, offers 65 National and local brands stores.  There is a Cinema with 7 theaters that offers food and alcohol at your theater seat. We are 10 blocks from Salem Hospital and birthing center. We are 11 blocks from historical Bush Park, gardens and art barn next to Deepwood historical mansion. <br /><br />Parks<br /><br />Riverfront Park is a 23-acre park located in downtown Salem along the Willamette River connects to Wallace Marine Park which has 114.45 acres park that is the home of one of the best sports facilities in the Northwest and has miles of walking, jogging and biking paths.  A $10 Million foot bridge is currently under construction and will open access to 800 a",https://a0.muscache.com/pictures/ca57bfdb-2a3e-4412-8ac5-d7127cd4a9e1.jpg,43537767,https://www.airbnb.com/users/show/43537767,Angela,2015-09-06,"Salem, Oregon, United States","My name is Angela Jones, I grew up and have lived in Salem for the majority of my life. It is my home and I am so excited to share it with visitors! I have twin boys Max and Sam, who I am currently using my vacation rentals income to help put them both through college! My boys are my world, and I am proud of both of them. 
I am also an Arbonne Independent Consultant. Arbonne provides pure, safe and beneficial health and beauty products. Our products are made for those that don't want to use harsh chemicals and want true results in their health and their looks! 

As I got closer to having to start paying for my boys college, I decided to launch my vacation rental business with my Downtown Salem Loft. a 2400 sq ft ""New York Style Loft"" Apartment in the oldest historical building in downtown Salem.  I quickly realized this was my nitch, I was great at hosting guests and providing beautiful, affordable lodging in our Capitol City and Greater Willamette Valley and so it began. My vacation rental company is SalemStays. Currently I have 7 vacation rentals in Salem, 1 In Independence Oregon towards the coast and wine country and 1 in Stayton Oregon on the trail to Silver Falls State park and the Oregon Gardens! I love the hospitality business and supplying guests with beautiful, comfortable, and usable spaces to stay in for a much more reasonable price than staying in a hotel. 

I love to get to know all my guests and to make new connections. I hope you stay with me if you ever come to Salem OR or the Greater Willamette Valley. ",within an hour,100%,99%,t,https://a0.muscache.com/im/pictures/user/4e84669f-2190-4f36-b7c7-4921d48bda7e.jpg?aki_policy=profile_small,https://a0.muscache.com/im/pictures/user/4e84669f-2190-4f36-b7c7-4921d48bda7e.jpg?aki_policy=profile_x_medium,South Central,12,12,"['email', 'phone', 'google', 'reviews', 'jumio', 'offline_government_id', 'selfie', 'government_id', 'identity_manual']",t,t,"Salem, Oregon, United States",Ward 1,,44.9419,-123.03976,Entire loft,Entire home/apt,5,,1 bath,2,2,"[""Extra pillows and blankets"", ""Children\u2019s books and toys"", ""Free street parking"", ""arbonne body soap"", ""Luggage dropoff allowed"", ""Indoor fireplace"", ""Air conditioning"", ""Laptop-friendly workspace"", ""Free parking on premises"", ""Freezer"", ""Stove"", ""Baking sheet"", ""Rice Maker"", ""arbonne conditioner"", ""Shampoo"", ""Coffee maker"", ""Bathtub"", ""Carbon monoxide alarm"", ""Dishwasher"", ""Heating"", ""Wifi"", ""Bed linens"", ""Hangers"", ""Iron"", ""Smoke alarm"", ""Dryer"", ""Hot water"", ""Kitchen"", ""Keypad"", ""Refrigerator"", ""Patio or balcony"", ""Microwave"", ""Cable TV"", ""Dishes and silverware"", ""First aid kit"", ""Cooking basics"", ""Private entrance"", ""Essentials"", ""Hair dryer"", ""Shower gel"", ""Trash compactor"", ""TV"", ""Oven"", ""Washer"", ""Fire extinguisher""]",$155.00,2,30,2,2,30,30,2.0,30.0,,t,3,3,25,286,2020-10-25,67,4,0,2015-09-21,2020-03-28,98,10,10,10,10,10,10,,f,8,7,1,0,1.08
