22215712,https://www.airbnb.com/rooms/22215712,20201025134909,2020-10-25,Private bedroom(s) close to I-5 (No cleaning fee),"We are offering 1 or 2 bedrooms with 1 bed each. The listed price is for 1 room. If you are 2 travelers looking for 2 rooms, please book as 3 guests to open up the 2nd room.<br /><br />It's a private home where we (husband and wife) live. Great neighborhood. Lots of restaurants, fast food and grocery stores nearby. A straight shot downtown, 15 minutes away; I-5 entrance is closer.<br /><br /> We have a very friendly cat, Firkin. We also have parrots which can be noisy in daytime.<br /><br /><b>The space</b><br />Bedrooms with queen bed.  Full bathroom is across the hall from your room. <br />There is a living room where guests may sit. Shared kitchen with hosts.<br /><br /><b>Guest access</b><br />There is a living room where you can watch streaming TV.<br /><br /><b>Other things to note</b><br />The bathroom is not en suite, but it is essentially exclusive for guest use. However, occasional evening visitors or friends or may use the facilities. <br /><br />Warnings: There is a cat, Am","We are 15 minutes from beautiful downtown Salem, 5 minutes I-5, 40 miles from Portland, 40 miles from the Oregon Coast. The neighborhood is quiet and safe within walking distance or short driving to Walmart, Winco, McDonald's, etc.",https://a0.muscache.com/pictures/97264628-9efa-4742-9c3d-8f895d0b03f8.jpg,161312832,https://www.airbnb.com/users/show/161312832,Emily,2017-12-04,"Salem, Oregon, United States","I am a retired medical transcriptionist. I was the first server in our craft brewery back in 2012 and loved serving people. Previously, I have been a housekeeper for two 5-star hotels. A long time ago I was an art student in Brooklyn. We moved a lot when I was a child because my father was in the Navy during WW2.

Ian is from England. We met 30 years ago when he was working in a quaint hostel in Ashland; a place known for its Shakespeare festival. I was a guest. He lived under the stairs just like Harry Potter. He is the head brewer in the craft brewery we’re partners in. ",N/A,N/A,100%,t,https://a0.muscache.com/im/pictures/user/00738f4f-4d04-4c2a-a029-a919697b0e7b.jpg?aki_policy=profile_small,https://a0.muscache.com/im/pictures/user/00738f4f-4d04-4c2a-a029-a919697b0e7b.jpg?aki_policy=profile_x_medium,,1,1,"['email', 'phone', 'reviews', 'jumio', 'offline_government_id', 'selfie', 'government_id', 'identity_manual']",t,t,"Salem, Oregon, United States",Ward 4,,44.87854,-123.03973,Private room in house,Private room,4,,1 shared bath,2,2,"[""Extra pillows and blankets"", ""Free street parking"", ""Lock on bedroom door"", ""Luggage dropoff allowed"", ""Air conditioning"", ""Laptop-friendly workspace"", ""Free parking on premises"", ""Stove"", ""Shampoo"", ""Coffee maker"", ""Bathtub"", ""Carbon monoxide alarm"", ""Dishwasher"", ""Heating"", ""Room-darkening shades"", ""Wifi"", ""Bed linens"", ""Hangers"", ""Iron"", ""Smoke alarm"", ""Smart lock"", ""Dryer"", ""Hot water"", ""Kitchen"", ""Refrigerator"", ""Patio or balcony"", ""Microwave"", ""Garden or backyard"", ""Dishes and silverware"", ""First aid kit"", ""Cooking basics"", ""Essentials"", ""Hair dryer"", ""TV"", ""Oven"", ""Washer"", ""Fire extinguisher""]",$42.00,1,4,1,1,4,4,1.0,4.0,,t,0,0,7,7,2020-10-25,252,28,0,2017-12-27,2020-07-06,96,10,10,10,10,10,10,,f,1,0,1,0,7.31
22295718,https://www.airbnb.com/rooms/22295718,20201025134909,2020-10-25,Heart of Downtown Sterilized like a Medical Clinic,"As it has always been, the safety and security of our guests remains our highest priority. We take great pride in maintaining the highest standards of cleanliness and hygiene. I have personally provided direct patient care for 39 years. In response to the coronavirus, we have taken additional measures developed in consultation with global and local public health authorities (including WHO and CDC) to make our cleaning and hygiene protocols more rigorous. Take home a antibacterial hand sanitizer.<br /><br /><b>The space</b><br />In light of COVID-19, our cleaning teams are receiving ongoing briefings and enhanced operating protocols.<br /><br />We have increased the frequency of cleaning our public areas (including lobbies, door handles, light switches, etc.) and have continued the use of hospital-grade disinfectant. In addition, the unit is fogged with a electrostatic disinfectant between guests to better insure a virus free environment for your safety.<br /><br />We have increased the","The center of Downtown Salem is a perfect place from which to explore downtown and Salem.  You are in the heart of Willamette Valley's wine industry, brew pubs, great coffee shops, and restaurants. Your mini-loft is located between Bently's Coffee and Great Harvest Baking.",https://a0.muscache.com/pictures/94261e12-2418-4ef1-be12-9c36f5ff837b.jpg,140972895,https://www.airbnb.com/users/show/140972895,Angela,2017-07-17,"Salem, Oregon, United States","About Angela Jones
I am a native Salemite and Oregonian! Born and raised right here, ""this is my town""! I have owned the building for 30 years but the Downtown Salem Loft is a new business to me. Everyone who saw it  just thought that it had to be shared because it was historical to keep all to myself, so I thought YES, I should share this one of a kind luxury living space. Voila, here we are on a whole new adventure n loving it!  (Website hidden by Airbnb) 

Why Angela Jones chose Central Area
I am thinking that this hospitality industry is a grand Industry! I started the Loft less than 2 years ago to pay for my twin boys college tuitions and it's been a landslide success. I am truly enjoying hosting and spoiling my guests. I appreciate the support and kind care folks take of my historical property. Please come enjoy my (Phone number hidden by Airbnb) ""oldest historical building"" in Downtown Salem Oregon and experience a brilliant holiday! (Phone number hidden by Airbnb) 
All my best, Angela Jones 

",within an hour,100%,99%,t,https://a0.muscache.com/im/pictures/user/ded01c1d-5614-4541-98d2-e91f18c41315.jpg?aki_policy=profile_small,https://a0.muscache.com/im/pictures/user/ded01c1d-5614-4541-98d2-e91f18c41315.jpg?aki_policy=profile_x_medium,,2,2,"['email', 'phone', 'reviews', 'jumio', 'offline_government_id', 'selfie', 'government_id', 'identity_manual', 'work_email']",t,t,"Salem, Oregon, United States",Ward 1,,44.94167,-123.04015,Entire guest suite,Entire home/apt,4,,1 bath,2,2,"[""Extra pillows and blankets"", ""Free street parking"", ""Indoor fireplace"", ""Air conditioning"", ""Laptop-friendly workspace"", ""Free parking on premises"", ""Stove"", ""Shampoo"", ""Coffee maker"", ""Carbon monoxide alarm"", ""Dishwasher"", ""Heating"", ""Wifi"", ""Bed linens"", ""Hangers"", ""Iron"", ""Smoke alarm"", ""Dryer"", ""Hot water"", ""Kitchen"", ""Keypad"", ""Refrigerator"", ""Microwave"", ""Cable TV"", ""Dishes and silverware"", ""First aid kit"", ""Cooking basics"", ""Essentials"", ""Hair dryer"", ""Breakfast"", ""TV"", ""Oven"", ""Washer"", ""Fire extinguisher""]",$135.00,2,60,2,2,1125,1125,2.0,1125.0,,t,29,56,83,344,2020-10-25,57,17,0,2018-01-19,2020-09-12,100,10,10,10,10,10,10,,f,2,2,0,0,1.69
23234197,https://www.airbnb.com/rooms/23234197,20201025134909,2020-10-25,"Convenient, modern family home base SE Salem 민박한국어","1500 square foot, single level house. Our modern and comfortable home could be a nice “home base” while you explore the Willamette valley!<br /><br />Notes: we no longer accept pets. <br />We are not set up for hosting parties (e.g. baby showers, bachelor parties, or other gatherings where people other than the verified guests will be present).<br /><br /><b>The space</b><br />Modern style 1500 sq foot home located in SE Salem.<br /><br />Two bedrooms available for use. We do have a futon mattress to use on the floor, too. <br />Please note one bedroom is locked for our personal storage. <br /><br />There are vaulted ceilings in the master bedroom, playroom, and living room. The living room is equipped with a 55” TV. The kitchen is ready for cooking - electric range/ oven, toaster, microwave, fridge, and coffee maker for you to use. <br /><br />The well lighted dining room could also double for some office space if you need to work on your laptop. <br /><br />The backyard is equipped w","Walking distance of Beehive food trucks and Safeway. 10 minute drive to downtown Salem / waterfront park, or Amtrak. Close to I-5 as well. Approximately 25 minutes to Woodburn Outlet shopping mall. Less than 10 minutes to Enchanted Forest and Willamette Valley Vineyards. Just a one hour drive each way to Portland, Eugene, or Lincoln City (and a casino on the way) on the coast. Also about 2 hours to Mt Hood SkiBowl and 2 1/2 hours to Bend, OR.",https://a0.muscache.com/pictures/899efabc-0d97-483c-bba6-ccc101a98f56.jpg,9643500,https://www.airbnb.com/users/show/9643500,Jason,2013-10-26,"Salem, Oregon, United States","I’m an elementary (and ESL) teacher and my wife is a stay at home mom to our 4 year old son. We lived in South Korea (my wife is Korean) and Japan for several years before settling in Salem, OR. 
We are hoping to travel again to Asia soon! ",within an hour,100%,100%,t,https://a0.muscache.com/im/users/9643500/profile_pic/1426057755/original.jpg?aki_policy=profile_small,https://a0.muscache.com/im/users/9643500/profile_pic/1426057755/original.jpg?aki_policy=profile_x_medium,,1,1,"['email', 'phone', 'jumio', 'offline_government_id', 'selfie', 'government_id', 'identity_manual']",t,t,"Salem, Oregon, United States",Ward 4,,44.87183,-123.03444,Entire house,Entire home/apt,6,,2 baths,2,2,"[""Extra pillows and blankets"", ""Single level home"", ""Children\u2019s books and toys"", ""Lockbox"", ""Indoor fireplace"", ""Air conditioning"", ""Laptop-friendly workspace"", ""Free parking on premises"", ""Stove"", ""Shampoo"", ""Coffee maker"", ""Bathtub"", ""Carbon monoxide alarm"", ""Dishwasher"", ""Heating"", ""BBQ grill"", ""Wifi"", ""Bed linens"", ""Children\u2019s dinnerware"", ""Hangers"", ""Pack \u2019n Play/travel crib"", ""Iron"", ""Smoke alarm"", ""Dryer"", ""Hot water"", ""Kitchen"", ""Refrigerator"", ""Microwave"", ""Garden or backyard"", ""Cable TV"", ""Dishes and silverware"", ""First aid kit"", ""Cooking basics"", ""Essentials"", ""Hair dryer"", ""Shower gel"", ""TV"", ""Oven"", ""Washer"", ""Fire extinguisher""]",$145.00,2,29,2,2,1125,1125,2.0,1125.0,,t,16,39,61,61,2020-10-25,64,7,0,2018-04-07,2020-09-21,98,10,10,10,10,10,10,,t,1,1,0,0,2.06
23320790,https://www.airbnb.com/rooms/23320790,20201025134909,2020-10-25,Quiet Residential Home For Traveling Nurses,"Our place is great for traveling nurses, just a 10min drive to the hospital.  We  are also a two minute walk to the bus line.",,https://a0.muscache.com/pictures/b02a0b27-87cd-4e0a-af28-29b73a0331ba.jpg,121661305,https://www.airbnb.com/users/show/121661305,Don,2017-03-20,"Salem, Oregon, United States","",within a few hours,100%,64%,t,https://a0.muscache.com/im/pictures/user/ea088140-8ebe-41ba-9806-7792efb43ecf.jpg?aki_policy=profile_small,https://a0.muscache.com/im/pictures/user/ea088140-8ebe-41ba-9806-7792efb43ecf.jpg?aki_policy=profile_x_medium,,2,2,"['email', 'phone', 'facebook', 'reviews']",t,f,,Ward 4,,44.87892,-123.01769,Private room in house,Private room,1,,1.5 shared baths,1,1,"[""Hangers"", ""Cable TV"", ""Iron"", ""Smoke alarm"", ""Essentials"", ""Indoor fireplace"", ""Air conditioning"", ""Dryer"", ""Heating"", ""Laptop-friendly workspace"", ""Hot tub"", ""Kitchen"", ""TV"", ""Washer"", ""Wifi""]",$29.00,7,1125,7,7,1125,1125,7.0,1125.0,,t,3,3,26,301,2020-10-25,1,0,0,2019-09-29,2019-09-29,100,10,10,10,10,10,10,,f,2,0,2,0,0.08
23576718,https://www.airbnb.com/rooms/23576718,20201025134909,2020-10-25,Large Salem Townhome Close to Wineries & Parks!,"Experience the beauty and serenity of the Pacific Northwest from the comfort of 'Salem's R&R Home,' a 3-bedroom, 1.5-bath vacation rental townhome in Southeast Salem. Not only does this 1,425-square-foot home's elegant decor create a remarkably cozy ambiance, its proximity to the area's hottest attractions makes it truly one-of-a-kind. After days spent touring wineries, exploring parks, and perusing markets, you'll look forward to watching the sunset from the comfort of your manicured backyard.<br /><br /><b>The space</b><br />Master Bedroom: King Bed | Bedroom 2: Queen Bed | Bedroom 3: 2 Twin Beds <br /><br />As you lounge in the living room, you'll be overwhelmed by the calming effect the room has on you. Boasting a plush couch, flat-screen satellite TV, and large windows, the room will truly feel like a private sanctuary. Beat the heat and stay cool, as you relax in this home's brand new quiet air-conditioning system. <br /><br />When stomachs start to rumble, head into the fully eq","Boasting old-time charm, beautiful seasonal scenery, and several flowing waterways, Salem has something for everyone! Head 6 minutes down the road to Riverfront City Park and embrace the fun family atmosphere. Home to a handmade carousel, a footbridge, and more, this 23-acre park is both fun and beautiful. <br /><br />Channel your inner sommelier by touring some of Willamette Valley's acclaimed wineries, or enjoy all the excitement surrounding Bush's Pasture Park, the location of the Salem Art Festival and Soap Box Derby. Alternatively, Oregon State Fairgrounds, a 185-acre venue, is home to many annual events, concerts, and other entertainment. <br /><br />Enjoy the warm weather by exploring the top-notch outdoor markets that sit less than a mile from the property. Operating between Spring and Fall, these markets offer arts, crafts, and fresh local produce for incredibly low prices. <br /><br />Don't feel like cooking? Take a quick walk to Word of Mouth Bistro, named Salem's restaurant",https://a0.muscache.com/pictures/8e2d8d24-36d0-4184-807b-7feaa6e8011b.jpg,121688409,https://www.airbnb.com/users/show/121688409,Evolve Vacation Rental,2017-03-20,United States,"Hi! We’re Evolve Vacation Rental, the hospitality team that helps you rest easy when you rent a private, professionally cleaned home from us.

We promise your rental will be clean, safe, and true to what you saw on Airbnb or we'll make it right. Check-ins are always smooth, and we're here 24/7 to answer any questions or help you find the perfect property.",within an hour,92%,99%,f,https://a0.muscache.com/im/pictures/user/44f02aaa-11f6-41de-bd22-9ed85a59bbaa.jpg?aki_policy=profile_small,https://a0.muscache.com/im/pictures/user/44f02aaa-11f6-41de-bd22-9ed85a59bbaa.jpg?aki_policy=profile_x_medium,Queen Anne,431,431,"['email', 'phone', 'reviews']",t,t,"Salem, Oregon, United States",Ward 2,,44.92933,-123.01933,Entire townhouse,Entire home/apt,6,,2 baths,3,4,"[""Air conditioning"", ""Free parking on premises"", ""Ethernet connection"", ""Coffee maker"", ""High chair"", ""Carbon monoxide alarm"", ""Dishwasher"", ""Heating"", ""BBQ grill"", ""Wifi"", ""Bed linens"", ""Pack \u2019n Play/travel crib"", ""Iron"", ""Smoke alarm"", ""Dryer"", ""Kitchen"", ""Refrigerator"", ""Microwave"", ""Garden or backyard"", ""Dishes and silverware"", ""First aid kit"", ""Private entrance"", ""Hair dryer"", ""TV"", ""Oven"", ""Washer"", ""Fire extinguisher""]",$171.00,2,1125,2,3,1125,1125,2.1,1125.0,,t,2,20,50,325,2020-10-25,5,2,0,2018-07-23,2020-06-22,96,10,10,10,10,10,9,,t,2,2,0,0,0.18
24019630,https://www.airbnb.com/rooms/24019630,20201025134909,2020-10-25,Century House Maple Suite,"Two bedrooms, a large completely refurbished master bath, a well-furnished kitchenette, and two common areas for eating, playing, working, reading, etc. Large queen room with lots of light, table/chairs, rocker, desk, and its own heating/cooling; and quiet corner room with double bed, easy chair, desk. Outside are dozens of shady places to relax, even in the rain.  Your reservation includes a significant morning ""snack"".  A full breakfast can be added for $10 per person with advance notice.<br /><br /><b>The space</b><br />Enjoy a large collection of handmade quilts, and a large collection of adventure stories related to bicycling and mountain climbing.  Also, find numerous amenities for young children.  Television is NOT one of them :-).",,https://a0.muscache.com/pictures/1522e388-6a18-4954-8ccc-b0fda3b59220.jpg,10502090,https://www.airbnb.com/users/show/10502090,Jean,2013-12-08,"Salem, Oregon, United States","Bicycling is my passion and my past-time, as well as my recipe for physical and emotional well-being.  Most recently, I have enjoyed “packing down” my bike with gear and heading down the road - for an overnight, or three, or three weeks.  This gives a whole new meaning to “bed and breakfast”.

When I’m not cycling, I’m usually busy cooking, cleaning, reading, sewing or watching the trees and flowers grow in my little forest; and, of course, accommodating the many fascinating guests who find their way to Century House from all corners of the globe.  My life is truly enriched by the diversity of perspectives and experiences that guests bring with them.

I confess, my favorite guests may be the children. With a full career of working in the field of early childhood, I never cease to be wowed by the uninhibited enthusiasm, curiosity, and resilience of the younger generation.  I am thrilled and dedicated to being a family-friendly business.

Another of my endeavors is the promotion/education of good nutrition.  I might be seen pedaling to a local farm to fill my packs with broccoli for the local food bank  - or, with fresh kale for a morning smoothie :-).  Don’t worry, there is still room for a brownie or an oatmeal cookie on the dessert tray.  After all, we need our dark chocolate, and our oatmeal, right?  

",within an hour,100%,93%,t,https://a0.muscache.com/im/users/10502090/profile_pic/1418163815/original.jpg?aki_policy=profile_small,https://a0.muscache.com/im/users/10502090/profile_pic/1418163815/original.jpg?aki_policy=profile_x_medium,,3,3,"['email', 'phone', 'reviews', 'kba']",t,t,,Ward 2,,44.93373,-123.01971,Private room in house,Private room,4,,1 private bath,2,2,"[""Free street parking"", ""Lock on bedroom door"", ""Indoor fireplace"", ""Air conditioning"", ""Laptop-friendly workspace"", ""Free parking on premises"", ""Shampoo"", ""Coffee maker"", ""Private living room"", ""Carbon monoxide alarm"", ""Heating"", ""Wifi"", ""Hangers"", ""Iron"", ""Smoke alarm"", ""Dryer"", ""Hot water"", ""Kitchen"", ""Refrigerator"", ""Microwave"", ""Host greets you"", ""Dishes and silverware"", ""Cooking basics"", ""Private entrance"", ""Essentials"", ""Hair dryer"", ""Breakfast"", ""Washer""]",$155.00,2,1125,2,2,1125,1125,2.0,1125.0,,t,18,48,78,353,2020-10-25,12,2,0,2018-04-20,2020-07-27,100,10,10,10,10,10,10,,f,3,0,3,0,0.39
24155499,https://www.airbnb.com/rooms/24155499,20201025134909,2020-10-25,Restful and Clean Guest Studio,"Modern, clean and restful guest studio in an older neighborhood. Air-conditioned. Private entrance & a 5 minute drive to downtown Salem, Willamette University, Oregon Fairgrounds and Interstate 5. <br />Central location to explore the Willamette Valley wineries, Silver Falls Park or the Oregon Coast. <br />Coffee, teas, and snacks provided for breakfast. <br />There is a playpen available in the unit if that is useful for your needs.<br /><br /> note: there is no TV or traditional shower.<br /><br /><b>The space</b><br />The guest studio is accessed through the alleyway behind the house. I hope that you are looking to find a restful and peaceful spot to recharge during your travels. <br /><br />Please note there is no TV. The bathing accommodations are a lovely deep tub with handheld sprayer, there is not a traditional shower.<br /><br /><b>Guest access</b><br />backyard, garden and patio furniture<br />If you are booked for a stay of two weeks or more, you will have access to the laun","This is a quiet and older neighborhood with a beautiful park just a block away. You will encounter neighbors walking and visiting and children walking to the nearby elementary school. There is a beautiful park a block away with majestic White Oak trees, playground equipment, a splash spot in summer and picnic tables.",https://a0.muscache.com/pictures/96b46f4f-75dd-4282-907a-dcba6b38f935.jpg,32693061,https://www.airbnb.com/users/show/32693061,Lisa,2015-05-05,"Salem, Oregon, United States","Hi there, I'm Lisa, I recently relocated to Oregon from the SF Bay Area and I thoroughly love it here in the beautiful Pacific Northwest!

I am a textile designer and artist and work in an art studio in downtown Salem.
I love creating, nature, learning, photography,starry night skies and chocolate

 As an Air BnB host, I like to provide a restful and restorative spot to relax and be filled. I leave a table of art supplies in the guest studio to encourage folks to have fun creating and imagining.",within an hour,100%,95%,t,https://a0.muscache.com/im/pictures/user/6d2bd386-4bc1-4558-b1bb-9d0dcbebfed0.jpg?aki_policy=profile_small,https://a0.muscache.com/im/pictures/user/6d2bd386-4bc1-4558-b1bb-9d0dcbebfed0.jpg?aki_policy=profile_x_medium,,2,2,"['email', 'phone', 'manual_online', 'reviews', 'manual_offline', 'kba', 'work_email']",t,t,"Salem, Oregon, United States",Ward 1,,44.94522,-123.01158,Entire guest suite,Entire home/apt,4,,1 bath,1,2,"[""Extra pillows and blankets"", ""Single level home"", ""Long term stays allowed"", ""Lockbox"", ""Air conditioning"", ""Laptop-friendly workspace"", ""Free parking on premises"", ""Shampoo"", ""Coffee maker"", ""Bathtub"", ""Carbon monoxide alarm"", ""Heating"", ""Wifi"", ""Bed linens"", ""Hangers"", ""Pack \u2019n Play/travel crib"", ""Iron"", ""Smoke alarm"", ""Hot water"", ""Kitchen"", ""Refrigerator"", ""Microwave"", ""Garden or backyard"", ""Dishes and silverware"", ""Cooking basics"", ""Private entrance"", ""Essentials"", ""Hair dryer"", ""Shower gel""]",$90.00,2,1125,2,2,1125,1125,2.0,1125.0,,t,15,40,62,152,2020-10-25,237,38,5,2018-04-14,2020-10-18,100,10,10,10,10,10,10,,f,2,2,0,0,7.68
24780208,https://www.airbnb.com/rooms/24780208,20201025134909,2020-10-25,Guest Cottage at Vista Manor,"Guest cottage located in South Salem on a large wooded lot. Close to restaurants, grocery stores, Banks, Parks, Willamette University and Salem Hospital. The bedroom is upstairs king with a king size bed. The sofa bed that is a double, is on the first floor. When we enter into spring ants are out. If food is left out on counters and tables it will attract ants. I ask guests not to leave food out. Guests who have been conscientious have not had an issue.<br /><br /><b>The space</b><br />The guest Cottage is a separate unit  attached to the main home but has a private entrance.My home was built in the 1920s. It is on a acre wooded lot. We have chickens, ducks, tortoises 4 cats and a dog. The animals are in a back  area of the property. Only the doggie comes out to visit our guests. Our guest of course are welcome to visit all the animals.<br /><br /><b>Guest access</b><br />Guests may use the shared swimming pool and hot tub. There is a back patio off the main house that guests are welco","I love my neighborhood. There are parks in walking distance, restaurants, grocery store.",https://a0.muscache.com/pictures/5661b8b9-b7da-4d8a-a599-18ff17244930.jpg,49073704,https://www.airbnb.com/users/show/49073704,Elizabeth,2015-11-15,"Salem, Oregon, United States","I am a nurse who has an Airbnb, Vista Manor in Salem Oregon. Love to travel, read hike, swim, cook and spend time with my family.",within an hour,100%,99%,t,https://a0.muscache.com/im/pictures/user/a62c6b8d-4855-4f5c-b60a-316c36fa06a9.jpg?aki_policy=profile_small,https://a0.muscache.com/im/pictures/user/a62c6b8d-4855-4f5c-b60a-316c36fa06a9.jpg?aki_policy=profile_x_medium,,11,11,"['email', 'phone', 'reviews']",t,f,"Salem, Oregon, United States",Ward 2,,44.91053,-123.04313,Entire guesthouse,Entire home/apt,4,,1 bath,1,1,"[""Extra pillows and blankets"", ""Children\u2019s books and toys"", ""Long term stays allowed"", ""Pool"", ""Free street parking"", ""Luggage dropoff allowed"", ""Indoor fireplace"", ""Air conditioning"", ""Babysitter recommendations"", ""Laptop-friendly workspace"", ""Baby bath"", ""Free parking on premises"", ""Stove"", ""Shampoo"", ""Coffee maker"", ""High chair"", ""Carbon monoxide alarm"", ""Dishwasher"", ""Heating"", ""Wifi"", ""Bed linens"", ""Children\u2019s dinnerware"", ""Hangers"", ""Pack \u2019n Play/travel crib"", ""Iron"", ""Smoke alarm"", ""Smart lock"", ""Dryer"", ""Hot water"", ""Kitchen"", ""Refrigerator"", ""Patio or balcony"", ""Microwave"", ""Garden or backyard"", ""Cable TV"", ""Dishes and silverware"", ""First aid kit"", ""Cooking basics"", ""Private entrance"", ""Essentials"", ""Hair dryer"", ""Hot tub"", ""Breakfast"", ""TV"", ""Oven"", ""Washer"", ""Fire extinguisher""]",$99.00,1,1125,1,2,1125,1125,1.0,1125.0,,t,22,39,64,64,2020-10-25,256,95,13,2018-05-04,2020-10-21,98,10,10,10,10,10,10,,f,4,1,3,0,8.48
