35512621,https://www.airbnb.com/rooms/35512621,20201025134909,2020-10-25,"Cozy, warming, friendly.",This is a new house that I purchase last month May 2019. I have a 120 inch laser tv available to watch movies in the living room. The community is friendly and for most part quiet.,,https://a0.muscache.com/pictures/f58afdac-3f3c-4d80-8809-d83f77fdd2ce.jpg,100462714,https://www.airbnb.com/users/show/100462714,Eduardo,2016-10-20,"Salem, Oregon, United States",I have my Associate of Arts Oregon Transfer Degree. Bachelors in Community Health Education Minor in Biology. I work full time for the State of Oregon serving Oregonians. I am a current student. Studying to pursue my career as an anesthetic nurse. I am respectful and kind. ,N/A,N/A,33%,f,https://a0.muscache.com/im/pictures/user/ef639ed3-80a9-4ca7-8cf1-08ea60cc0b6d.jpg?aki_policy=profile_small,https://a0.muscache.com/im/pictures/user/ef639ed3-80a9-4ca7-8cf1-08ea60cc0b6d.jpg?aki_policy=profile_x_medium,,1,1,"['email', 'phone', 'facebook', 'reviews', 'jumio', 'offline_government_id', 'government_id', 'work_email']",t,t,,Ward 5,,45.00033,-122.95882,Private room in house,Private room,2,,1.5 baths,1,1,"[""Shampoo"", ""Private living room"", ""Hangers"", ""Smoke alarm"", ""Carbon monoxide alarm"", ""Private entrance"", ""Essentials"", ""Air conditioning"", ""Dryer"", ""Hot water"", ""Laptop-friendly workspace"", ""Heating"", ""Free parking on premises"", ""Kitchen"", ""Hair dryer"", ""TV"", ""Refrigerator"", ""Washer""]",$100.00,1,1125,1,1,1125,1125,1.0,1125.0,,t,0,0,0,52,2020-10-25,2,0,0,2019-06-17,2019-06-29,90,10,10,8,10,8,10,,t,1,0,1,0,0.12
36387680,https://www.airbnb.com/rooms/36387680,20201025134909,2020-10-25,Angry Owl Hideout in the Capital City of Salem OR,"As it has always been, the safety and security of our guests remains our highest priority. We take great pride in maintaining the highest standards of cleanliness and hygiene. I myself have provided direct patient care for 39 years. In response to the coronavirus, we have taken additional measures developed in consultation with global and local public health authorities (including WHO and CDC) to make our cleaning and hygiene protocols more rigorous. Please take home a personal hand sanitizer.<br /><br /><b>The space</b><br />Our teams are receiving ongoing briefings and enhanced operating protocols.<br />We have increased the frequency of cleaning our public areas (including lobbies, door handles, etc.) and have continued the use of hospital-grade disinfectant.<br />We have increased the deployment of antibacterial hand sanitizers.<br />We have even made personal take home antibacterial hand sanitizers for your purse or travel bag. <br />The Angry Owl Hideout is a Bespoke Sanctuary! O","The neighborhood is set a little bit away from downtown (about 1.5 miles), but it is still an easy walk for hikers or bikers into downtown and super close to Bush Park. It's also an easy walk to Willamette University, Salem Hospital and the downtown core for such delicious treats as a dinner out at Table 508 or an evening at the Elsinore Theater. The park itself is home to the Art Fair and several other festivals in the summer months such as the derby and the sofa races. Yes, you too can easily walk to the park from your home to watch people race sofas down the derby track. I might suggest a cup of coffee from Archive or the Konditeri before you start.Like other historic neighborhoods, Bush Park homes vary greatly in architecture, size, and amenities. Part of this neighborhood is designated in Salem’s designated Historic District. The Historic District is on Lefelle and within one block of Bush park. You will also find a smattering of homes that are on the National Historic Register as",https://a0.muscache.com/pictures/333a660f-904b-47e8-bb97-9a324e3e0cdf.jpg,43537767,https://www.airbnb.com/users/show/43537767,Angela,2015-09-06,"Salem, Oregon, United States","My name is Angela Jones, I grew up and have lived in Salem for the majority of my life. It is my home and I am so excited to share it with visitors! I have twin boys Max and Sam, who I am currently using my vacation rentals income to help put them both through college! My boys are my world, and I am proud of both of them. 
I am also an Arbonne Independent Consultant. Arbonne provides pure, safe and beneficial health and beauty products. Our products are made for those that don't want to use harsh chemicals and want true results in their health and their looks! 

As I got closer to having to start paying for my boys college, I decided to launch my vacation rental business with my Downtown Salem Loft. a 2400 sq ft ""New York Style Loft"" Apartment in the oldest historical building in downtown Salem.  I quickly realized this was my nitch, I was great at hosting guests and providing beautiful, affordable lodging in our Capitol City and Greater Willamette Valley and so it began. My vacation rental company is SalemStays. Currently I have 7 vacation rentals in Salem, 1 In Independence Oregon towards the coast and wine country and 1 in Stayton Oregon on the trail to Silver Falls State park and the Oregon Gardens! I love the hospitality business and supplying guests with beautiful, comfortable, and usable spaces to stay in for a much more reasonable price than staying in a hotel. 

I love to get to know all my guests and to make new connections. I hope you stay with me if you ever come to Salem OR or the Greater Willamette Valley. ",within an hour,100%,99%,t,https://a0.muscache.com/im/pictures/user/4e84669f-2190-4f36-b7c7-4921d48bda7e.jpg?aki_policy=profile_small,https://a0.muscache.com/im/pictures/user/4e84669f-2190-4f36-b7c7-4921d48bda7e.jpg?aki_policy=profile_x_medium,South Central,12,12,"['email', 'phone', 'google', 'reviews', 'jumio', 'offline_government_id', 'selfie', 'government_id', 'identity_manual']",t,t,"Salem, Oregon, United States",Ward 2,,44.91747,-123.03859,Entire apartment,Entire home/apt,2,,1 bath,1,1,"[""Extra pillows and blankets"", ""Long term stays allowed"", ""Free street parking"", ""Indoor fireplace"", ""Air conditioning"", ""Laptop-friendly workspace"", ""Free parking on premises"", ""Stove"", ""Shampoo"", ""Coffee maker"", ""Carbon monoxide alarm"", ""Dishwasher"", ""Heating"", ""Wifi"", ""Bed linens"", ""Hangers"", ""Iron"", ""Smoke alarm"", ""Dryer"", ""Hot water"", ""Kitchen"", ""Keypad"", ""Refrigerator"", ""Patio or balcony"", ""Microwave"", ""Garden or backyard"", ""Cable TV"", ""Dishes and silverware"", ""First aid kit"", ""Cooking basics"", ""Private entrance"", ""Essentials"", ""Hair dryer"", ""Breakfast"", ""TV"", ""Oven"", ""Washer"", ""Fire extinguisher""]",$120.00,2,60,2,2,1125,1125,2.0,1125.0,,t,19,48,78,353,2020-10-25,23,23,3,2019-11-03,2020-10-18,100,10,10,10,10,10,10,,f,8,7,1,0,1.93
36771163,https://www.airbnb.com/rooms/36771163,20201025134909,2020-10-25,Top Floor Suite at Parke 325,"Gorgeous top floor suite for your work or vacation travels in beautiful downtown Salem!  This awesome space is in the brand new Parke 325 building. Crisp, modern finishes on every inch of this 1 bedroom/1bath condo. Stainless steel kitchen appliances are ready to be utilized! Shelves are fully stocked w/cooking supplies & a coffee station. A glass enclosed shower, fluffy linens & complimentary toiletries. A queen bed is all yours & comes with a private balcony & a pull out in the living room!<br /><br /><b>The space</b><br />This suite is on the 6th floor of the building with lovely treetop views from the back east facing side and a stunning sunsets from the front.","Two blocks to bustling yet quaint downtown Salem.  Safeway is across the street for any last minute needs or meals. So many cool little stores, coffee shops and dining options just a couple of blocks away.",https://a0.muscache.com/pictures/228a435f-3371-4bef-85aa-754db2b0ead0.jpg,171857446,https://www.airbnb.com/users/show/171857446,Troy,2018-02-05,"Portland, Oregon, United States","",within an hour,94%,98%,f,https://a0.muscache.com/im/pictures/user/dbaee3bf-ae9e-4670-8b8f-b14eb7960553.jpg?aki_policy=profile_small,https://a0.muscache.com/im/pictures/user/dbaee3bf-ae9e-4670-8b8f-b14eb7960553.jpg?aki_policy=profile_x_medium,,1,1,"['email', 'phone']",t,f,"Salem, Oregon, United States",Ward 1,,44.93984,-123.02586,Entire apartment,Entire home/apt,3,,1 bath,1,2,"[""Extra pillows and blankets"", ""Free street parking"", ""Lockbox"", ""Air conditioning"", ""Laptop-friendly workspace"", ""Free parking on premises"", ""Stove"", ""Shampoo"", ""Coffee maker"", ""Carbon monoxide alarm"", ""Dishwasher"", ""Heating"", ""Wifi"", ""Bed linens"", ""Hangers"", ""Iron"", ""Smoke alarm"", ""Dryer"", ""Hot water"", ""Kitchen"", ""Refrigerator"", ""Patio or balcony"", ""Microwave"", ""Elevator"", ""Dishes and silverware"", ""Cooking basics"", ""Private entrance"", ""Essentials"", ""TV"", ""Oven"", ""Washer"", ""Fire extinguisher""]",$115.00,1,1125,1,2,1125,1125,1.0,1125.0,,t,12,12,29,119,2020-10-25,16,9,0,2019-07-27,2020-08-26,90,10,10,9,10,10,9,,t,2,2,0,0,1.05
36806045,https://www.airbnb.com/rooms/36806045,20201025134909,2020-10-25,1941 Craftsman in Salem  w/ Private Backyard Patio,"If you are looking for a long term rental to hunker down during this crisis, I have availability from the last week of March through April 30. I will be willing to do special pricing as well! <br /><br />This newly remodeled 1941 Craftsman home, settled in the heart of Salem, will ease your mind and soothe your soul! Feel right at home with brand new comfy mattresses, textiles and amenities. Thoughtfully designed with coastal decor and soothing color pallet to create a calming environment.<br /><br /><b>The space</b><br />Throughout the years we have stayed in many airbnb's and understand the little things that make a place an enjoyable stay. With that thought, we have designed this home with comfort, cleanliness and style in mind. Our goal is to make sure you have everything you need and expect as if you were at home.<br /><br />This house is a dedicated vacation rental. You wont find any personal belongings or surprises lurking in closets, drawers, and cabinets during your stay.<br /","Perfect location! 1 hour from the gorgeous Oregon Coast, 1 hour from Portland, 45 minutes from the famous Mt Hood National Forest and only 5 minutes away from the Willamette River and Riverfront City Park! It's also conveniently located 5 min from Willamette University, the Oregon State Capitol, Downtown Salem, the State Fairgrounds, and Interstate 5.",https://a0.muscache.com/pictures/50d9cdf0-807f-4528-8c23-200539ccf484.jpg,276655122,https://www.airbnb.com/users/show/276655122,Kathie,2019-07-16,US,"",within a day,67%,97%,t,https://a0.muscache.com/im/pictures/user/73031d4c-6210-468b-afa9-7af20dc68eb2.jpg?aki_policy=profile_small,https://a0.muscache.com/im/pictures/user/73031d4c-6210-468b-afa9-7af20dc68eb2.jpg?aki_policy=profile_x_medium,,0,0,['phone'],t,f,"Salem, Oregon, United States",Ward 1,,44.94938,-123.00607,Entire house,Entire home/apt,6,,1 bath,3,4,"[""Extra pillows and blankets"", ""Children\u2019s books and toys"", ""Long term stays allowed"", ""Free street parking"", ""Luggage dropoff allowed"", ""Indoor fireplace"", ""Laptop-friendly workspace"", ""Free parking on premises"", ""Stove"", ""Shampoo"", ""Coffee maker"", ""Bathtub"", ""Carbon monoxide alarm"", ""Dishwasher"", ""Heating"", ""BBQ grill"", ""Wifi"", ""Bed linens"", ""Hangers"", ""Iron"", ""Smoke alarm"", ""Dryer"", ""Hot water"", ""Kitchen"", ""Keypad"", ""Refrigerator"", ""Patio or balcony"", ""Microwave"", ""Barbecue utensils"", ""Garden or backyard"", ""Cable TV"", ""Dishes and silverware"", ""Cooking basics"", ""Private entrance"", ""Essentials"", ""Hair dryer"", ""Shower gel"", ""TV"", ""Oven"", ""Washer"", ""Fire extinguisher""]",$147.00,1,31,1,2,1125,1125,1.0,1125.0,,t,0,0,7,280,2020-10-25,41,25,0,2019-07-23,2020-03-22,97,10,10,10,10,9,10,,t,1,1,0,0,2.67
37157862,https://www.airbnb.com/rooms/37157862,20201025134909,2020-10-25,Large 2 Bedroom 1 Bath Condo with a Creek View,"ABSOLUTELY NO SMOKING, DRUG-USE OR PARTIES WILL BE TOLERATED-  We have an on-site Manager.<br /> Over 1000 SF! Sunny and bright two bedrooms,  large bathroom, full kitchen, large living room, creekside condo just blocks from downtown Salem. Wonderful view of  historic Mill Creek and large balcony overlooking the creek. Reserved parking . Three blocks from Salem Center Mall, five blocks from State Capital and six from Willamette University.<br /><br /><br />Well Behaved Pets ARE WELCOME!<br /><br /><b>The space</b><br />With the creek view, you feel like you are camping but with the convenience of being in the City Center.<br /><br />You will have one assigned parking spot directly next to the condo (10 feet away) and a second spot is available (it is a compact spot that requires you to coordinate parking both cars as it overlaps partially with your main spot.<br /><br />Over 1000 SF! Sunny and bright two bedrooms,  large bathroom, full kitchen, large living room, creekside condo just b","Downtown Salem.  Just blocks from Historic Cottage Street and the State Capital grounds.  Walking distance to the restaurants and shops in downtown as well as the State Capital grounds, Willamette University, Salem Hospital, Riverfront Park.",https://a0.muscache.com/pictures/52a7038c-63b1-49cb-9d1f-e5138722f2e5.jpg,142420980,https://www.airbnb.com/users/show/142420980,Amanda,2017-07-25,"Oregon, United States",Love to travel and spend time with my family and our dog!  Grew up in Oregon and loved coming back after college.,within an hour,96%,99%,t,https://a0.muscache.com/im/pictures/user/69d78130-dfa0-4188-af78-45f552afa65f.jpg?aki_policy=profile_small,https://a0.muscache.com/im/pictures/user/69d78130-dfa0-4188-af78-45f552afa65f.jpg?aki_policy=profile_x_medium,,2,2,"['email', 'phone', 'reviews', 'jumio', 'offline_government_id', 'selfie', 'government_id', 'identity_manual', 'work_email']",t,t,"Salem, Oregon, United States",Ward 1,,44.94732,-123.03173,Entire condominium,Entire home/apt,5,,1 bath,2,2,"[""Extra pillows and blankets"", ""Air conditioning"", ""Laptop-friendly workspace"", ""Free parking on premises"", ""Shampoo"", ""Carbon monoxide alarm"", ""Heating"", ""Wifi"", ""Bed linens"", ""Hangers"", ""Iron"", ""Smoke alarm"", ""Dryer"", ""Hot water"", ""Kitchen"", ""Keypad"", ""First aid kit"", ""Private entrance"", ""Essentials"", ""Hair dryer"", ""TV"", ""Washer"", ""Fire extinguisher""]",$86.00,1,120,1,2,120,120,1.0,120.0,,t,12,31,53,322,2020-10-25,81,58,3,2019-07-28,2020-10-22,96,10,10,10,10,10,9,,t,5,5,0,0,5.33
37362173,https://www.airbnb.com/rooms/37362173,20201025134909,2020-10-25,Conference? Work? Government? End your day at home,,,https://a0.muscache.com/pictures/8b45aac4-1600-4a25-8381-6399e7342d53.jpg,199289022,https://www.airbnb.com/users/show/199289022,Marissa,2018-07-01,"Salem, Oregon, United States",My husband and I are teachers from Oregon. We are a quiet couple who just enjoy quiet leisurely vacations with sightseeing and emerging in the culture of a new place.,N/A,N/A,100%,f,https://a0.muscache.com/im/pictures/user/80825f91-0db8-4c7d-a911-798d44f6890c.jpg?aki_policy=profile_small,https://a0.muscache.com/im/pictures/user/80825f91-0db8-4c7d-a911-798d44f6890c.jpg?aki_policy=profile_x_medium,,2,2,"['email', 'phone', 'offline_government_id', 'government_id']",t,t,,Ward 7,,44.87183,-123.07568,Private room in house,Private room,2,,1 shared bath,2,1,"[""Extra pillows and blankets"", ""Single level home"", ""Long term stays allowed"", ""Free street parking"", ""Indoor fireplace"", ""Air conditioning"", ""Laptop-friendly workspace"", ""Free parking on premises"", ""Stove"", ""Shampoo"", ""Coffee maker"", ""Private living room"", ""Carbon monoxide alarm"", ""Dishwasher"", ""Heating"", ""Wifi"", ""Bed linens"", ""Hangers"", ""Iron"", ""Smoke alarm"", ""Dryer"", ""Hot water"", ""Kitchen"", ""Cleaning before checkout"", ""Game console"", ""Refrigerator"", ""Patio or balcony"", ""Microwave"", ""Cable TV"", ""Dishes and silverware"", ""First aid kit"", ""Cooking basics"", ""Essentials"", ""Hair dryer"", ""Breakfast"", ""TV"", ""Oven"", ""Washer"", ""Fire extinguisher""]",$150.00,1,1125,1,1,1125,1125,1.0,1125.0,,t,27,57,57,57,2020-10-25,0,0,0,,,,,,,,,,,f,1,0,1,0,
37723906,https://www.airbnb.com/rooms/37723906,20201025134909,2020-10-25,Large Creek View 2 Bedroom 2 Bath Condo,"ABSOLUTELY NO SMOKING, DRUG-USE OR PARTIES WILL BE TOLERATED-  We have an on-site Manager.<br />Over 1000 SF! Sunny and bright two bedrooms. TWO bathrooms, full kitchen, large living room, and wonderful deck overlooking Mill Creek.   Just blocks from downtown Salem. Wonderful view of historic Mill Creek and large balcony overlooking the creek. Reserved parking .  Well Behaved Pets ARE WELCOME! Assigned, covered parking right in front of the condo!<br /><br /><b>The space</b><br />With the creek view, you feel like you are camping but with the convenience of being in the City Center.  Three blocks from Salem Center Mall, five blocks from State Capital and six from Willamette University.<br /><br />You will have one assigned parking spot directly next to the condo (10 feet away) and a second spot is available (it is a compact spot that requires you to coordinate parking both cars as it overlaps partially with your main spot.<br /><br />Over 1000 SF! Sunny and bright two bedrooms,  two ba","Downtown Salem.  Just blocks from Historic Cottage Street and the State Capital grounds.  Walking distance to the restaurants and shops in downtown as well as the State Capital grounds, Willamette University, Salem Hospital, Riverfront Park.",https://a0.muscache.com/pictures/36c588c6-1316-4530-98ee-9d8f1b1e464a.jpg,142420980,https://www.airbnb.com/users/show/142420980,Amanda,2017-07-25,"Oregon, United States",Love to travel and spend time with my family and our dog!  Grew up in Oregon and loved coming back after college.,within an hour,96%,99%,t,https://a0.muscache.com/im/pictures/user/69d78130-dfa0-4188-af78-45f552afa65f.jpg?aki_policy=profile_small,https://a0.muscache.com/im/pictures/user/69d78130-dfa0-4188-af78-45f552afa65f.jpg?aki_policy=profile_x_medium,,2,2,"['email', 'phone', 'reviews', 'jumio', 'offline_government_id', 'selfie', 'government_id', 'identity_manual', 'work_email']",t,t,"Salem, Oregon, United States",Ward 6,,44.9462,-123.00269,Entire condominium,Entire home/apt,6,,2 baths,2,2,"[""Extra pillows and blankets"", ""Air conditioning"", ""Laptop-friendly workspace"", ""Free parking on premises"", ""Shampoo"", ""Coffee maker"", ""Carbon monoxide alarm"", ""Heating"", ""Wifi"", ""Bed linens"", ""Hangers"", ""Iron"", ""Smoke alarm"", ""Smart lock"", ""Dryer"", ""Hot water"", ""Kitchen"", ""Microwave"", ""Dishes and silverware"", ""First aid kit"", ""Private entrance"", ""Essentials"", ""Hair dryer"", ""TV"", ""Washer"", ""Fire extinguisher""]",$86.00,1,45,1,2,45,45,1.0,45.0,,t,23,48,59,236,2020-10-25,45,42,6,2019-08-21,2020-10-19,96,10,10,10,10,10,10,,t,5,5,0,0,3.13
37815385,https://www.airbnb.com/rooms/37815385,20201025134909,2020-10-25,"Cozy, convenient room in Salem","Welcome to our home in Salem! We are located between downtown and Lancaster Drive, and are surrounded by parks, grocery stores, and shops. We offer a private and cozy room with it's own entry from the front of the house. Access to the laundry room, kitchen, a private bathroom, and the living room are also included. The home is within driving distance to the Oregon Coast, Portland, wineries, and some of the best hiking spots you could ever ask for.<br /><br />We would love to welcome you as our guest!<br /><br /><b>The space</b><br />The room has a separate entry from the front of the house with a keypad door, meaning you won't have to worry about carrying around a key! It also features a cozy full sized bed, TV with Netflix, desk, and closet space. You are more than welcome to use the kitchen and all of the cooking supplies in it, as well as the fridge and pantry. A washer and dryer are also available for you to use.<br /><br />We have a dog here, a very friendly mutt that loves to say","This is an older neighborhood outside of downtown Salem. With big tall oak and maple trees and wonderful older homes nearby, the neighborhood has beautiful falls with red, orange and yellow leaves falling from the trees. Every house in the area is uniquely built, providing some great moments of thinking “woah, what a cool house!” as you drive by.",https://a0.muscache.com/pictures/5f968b8a-e718-439f-8b2d-e3134f81f0d3.jpg,138914826,https://www.airbnb.com/users/show/138914826,Riley & Cory,2017-07-06,"Salem, Oregon, United States","I enjoy watching and playing sports, cooking, learning, and seeing the world out around me. I love to meet and talk to all sorts of different people from all sorts of different backgrounds and experiences. ",within an hour,100%,97%,t,https://a0.muscache.com/im/pictures/user/971a7f39-eeb8-49fe-bccf-e5068a6e94e4.jpg?aki_policy=profile_small,https://a0.muscache.com/im/pictures/user/971a7f39-eeb8-49fe-bccf-e5068a6e94e4.jpg?aki_policy=profile_x_medium,,0,0,"['email', 'phone', 'reviews', 'offline_government_id', 'selfie', 'government_id', 'identity_manual']",t,t,"Salem, Oregon, United States",Ward 1,,44.94267,-123.01436,Private room in house,Private room,2,,1 private bath,1,1,"[""Extra pillows and blankets"", ""Single level home"", ""Lock on bedroom door"", ""Air conditioning"", ""Laptop-friendly workspace"", ""Free parking on premises"", ""Stove"", ""Baking sheet"", ""Shampoo"", ""Coffee maker"", ""Carbon monoxide alarm"", ""Dishwasher"", ""Heating"", ""Wifi"", ""Smoke alarm"", ""Dryer"", ""Hot water"", ""Kitchen"", ""Keypad"", ""Refrigerator"", ""Barbecue utensils"", ""Dishes and silverware"", ""First aid kit"", ""Cooking basics"", ""Private entrance"", ""Essentials"", ""TV"", ""Oven"", ""Washer"", ""Fire extinguisher""]",$40.00,1,7,1,1,7,7,1.0,7.0,,t,23,51,70,148,2020-10-25,59,59,5,2019-11-15,2020-10-17,97,10,9,10,10,10,10,,f,1,0,1,0,5.12
38976509,https://www.airbnb.com/rooms/38976509,20201025134909,2020-10-25,The Bunkhouse,"Located close to Englewood Park,  the Bunkhouse is a unique, cabin-like dwelling.<br /><br />Some say smaller than a tiny house, The Bunkhouse still has all the necessities for living: *dry toilet (google Loveable Loo for dry toilet information)<br />* mini kitchen - cold water in jugs, mini fridge, induction hot plate, toaster oven, hot water from dispenser or electric kettle,  all necessary utensils<br />* elevated twin futon bed<br />* easy chair and  TV tray for a table<br />* a view into the tall trees<br /><br /><b>The space</b><br />It's amazing what little space some of us actually need to be comfortable. At a cozy 8x8 feet, The Bunkhouse is a place to see that for yourself.  It's a precious little space full of original art, good books, a view into the tall trees, and all the basics for a uniquely comfortable stay in Salem.<br /><br /><b>Other things to note</b><br />The bunkhouse has a dry toilet, meaning it does not flush but uses sawdust instead. Please google Loveable Loo ","Englewood is a beautiful, diverse, historic neighborhood surrounded by towering Douglas Fir, Western Red Cedar, and Oregon White Oak. <br />Joe Mocha Coffee Shop is a few blocks away, Safeway and the Oregon State Hospital are about a half mile, while downtown Salem, Willamette University, and the Amtrak Station are an easy mile-or-so walk.",https://a0.muscache.com/pictures/miso/Hosting-38976509/original/f32f9aa0-f685-495a-90f7-286ff1067a0f.jpeg,183514,https://www.airbnb.com/users/show/183514,Ruth,2010-07-28,"Salem, Oregon, United States","I am an actively engaged, retired restaurant owner/operator and community college instructor who is raising her 5year old (charming and very easy to be with) granddaughter. No dogs live here at the moment but one may appear at any time.",within an hour,100%,83%,t,https://a0.muscache.com/im/users/183514/profile_pic/1314581151/original.jpg?aki_policy=profile_small,https://a0.muscache.com/im/users/183514/profile_pic/1314581151/original.jpg?aki_policy=profile_x_medium,,2,2,"['email', 'phone', 'facebook', 'reviews', 'kba']",t,t,"Salem, Oregon, United States",Ward 1,,44.94348,-123.01219,Tiny house,Entire home/apt,1,,0 baths,1,1,"[""Extra pillows and blankets"", ""Free street parking"", ""Luggage dropoff allowed"", ""Laptop-friendly workspace"", ""Freezer"", ""Heating"", ""Pour Over Coffee"", ""Wifi"", ""Bed linens"", ""Mini fridge"", ""Hot water"", ""Kitchen"", ""Laundromat nearby"", ""Induction Hot Plate electric stove"", ""Host greets you"", ""Garden or backyard"", ""Dishes and silverware"", ""Cooking basics"", ""Private entrance"", ""Toaster Oven only stainless steel oven"", ""Essentials"", ""Breakfast"", ""Portable fans""]",$35.00,2,14,2,2,1125,1125,2.0,1125.0,,t,28,58,88,178,2020-10-25,7,7,0,2019-12-11,2020-04-02,94,10,10,10,10,10,10,,f,1,1,0,0,0.66
